id,name,path,mimeType,modifiedTime,owner,size,driveId,parents
0AHZG-qV0huDxUk9PVA,My Drive,/My Drive,application/vnd.google-apps.folder,,,,,
1-4TTL6M9IHr2QdBjaCsDgwTuS1QXEvHR1xdKJ0b0OJ4,Copy of Product Evals & Validation for AI for Equity Community,/My Drive/Copy of Product Evals & Validation for AI for Equity Community,application/vnd.google-apps.spreadsheet,2025-10-15T18:57:29.342Z,pcuenco@elhaynes.org,6640,,0AHZG-qV0huDxUk9PVA
1_VJZx-xJEP3aEVPZi9wFpsJRr_o5QXB6,Office 2024 Setup,/My Drive/Office 2024 Setup,application/vnd.google-apps.folder,2025-10-15T13:42:12.430Z,pcuenco@elhaynes.org,,,0AHZG-qV0huDxUk9PVA
1GbPu53mHXyDoTeiKvCuDQJSEf3d2c-c1FSG2ymxP3HY,Untitled presentation,/My Drive/Untitled presentation,application/vnd.google-apps.presentation,2025-10-15T13:37:43.791Z,pcuenco@elhaynes.org,145526,,0AHZG-qV0huDxUk9PVA
1VXHpsddkC6jqI1atOVG4qPZ70B8pQkbrEvTDQMcAf54,Assessment Testing Calendar,/My Drive/Assessment Testing Calendar,application/vnd.google-apps.spreadsheet,2025-10-14T18:05:53.683Z,pcuenco@elhaynes.org,2854,,0AHZG-qV0huDxUk9PVA
1r7AhpjxSibkEyg8gLQ7ukOrO45iYg1ANyYJhRtUJLR4,AAC - IPAD Devices,/My Drive/AAC - IPAD Devices,application/vnd.google-apps.spreadsheet,2025-10-14T14:46:19.477Z,pcuenco@elhaynes.org,2090,,0AHZG-qV0huDxUk9PVA
1Cbq3rwVQ0eQVInUKTMeSVTWkERc0pp9THavZKlSOEWo,DNS Meeting,/My Drive/DNS Meeting,application/vnd.google-apps.document,2025-10-08T15:23:04.673Z,pcuenco@elhaynes.org,1024,,0AHZG-qV0huDxUk9PVA
1E4jihCMzZaWoQFts704Axkjg8R8yVHRo,Laptop,/My Drive/Laptop,application/vnd.google-apps.folder,2025-10-08T14:14:14.490Z,pcuenco@elhaynes.org,,,0AHZG-qV0huDxUk9PVA
16kKv811rOos3yh6luJ3RUDsa4i-1MOpa4-26r1jRuWI,user-lookup,/My Drive/user-lookup,application/vnd.google-apps.spreadsheet,2025-10-07T19:25:56.898Z,pcuenco@elhaynes.org,1024,,0AHZG-qV0huDxUk9PVA
19CRiU2P_E3hMXQ9nRvtHmuUWirCGYCZMCzI8nCTeFGg,"in google sheets, i want to auto fill the value i...","/My Drive/in google sheets, i want to auto fill the value i...",application/vnd.google-apps.spreadsheet,2025-10-06T17:33:16.775Z,pcuenco@elhaynes.org,1512,,0AHZG-qV0huDxUk9PVA
10wT5lvxuhBVl0epiuau3c3c9500k_zv3H_LuqLeRtpo,AD-Group-Mapping,/My Drive/AD-Group-Mapping,application/vnd.google-apps.spreadsheet,2025-10-06T17:31:05.760Z,pcuenco@elhaynes.org,1024,,0AHZG-qV0huDxUk9PVA
1rPpppqb_UWX01_TaRDkhVOln-i4ZEEp734LjzkUCMMw,25-26 Goals,/My Drive/25-26 Goals,application/vnd.google-apps.document,2025-10-03T13:52:15.307Z,pcuenco@elhaynes.org,1024,,0AHZG-qV0huDxUk9PVA
1xpyZgFeOQkUHp6qJC6Xa8QLiix-ScAtDICl68ekhSBo,Supplies Request Approval Workflow,/My Drive/Supplies Request Approval Workflow,application/vnd.google-apps.document,2025-09-30T20:14:30.397Z,pcuenco@elhaynes.org,29081,,0AHZG-qV0huDxUk9PVA
1sgdqPPXSwnFfUSJBC3oDFVLpJULDH8qoFpZG1zR_PAk,M-J-A-P,/My Drive/M-J-A-P,application/vnd.google-apps.document,2025-09-24T19:43:22.541Z,pcuenco@elhaynes.org,1024,,0AHZG-qV0huDxUk9PVA
1SPQ4zIR3cN0xBFPlY_uth92VBQcy9Ss6MBxNuGMilKw,IT Ticketing and Collaboration Guidelines,/My Drive/IT Ticketing and Collaboration Guidelines,application/vnd.google-apps.document,2025-09-24T14:01:59.753Z,pcuenco@elhaynes.org,5834,,0AHZG-qV0huDxUk9PVA
1O8tA5pxHC_FYtpXxv53-Ja1ZStrmXwaZr7BkglXIbVE,GCDS,/My Drive/GCDS,application/vnd.google-apps.document,2025-09-22T15:58:35.375Z,pcuenco@elhaynes.org,245213,,0AHZG-qV0huDxUk9PVA
10q702k2OKD7CG3nsRgu4g3emEhoTf5CuXaG2RTmmyFc,Incident IQ Change Log,/My Drive/Incident IQ Change Log,application/vnd.google-apps.document,2025-09-22T15:27:24.530Z,pcuenco@elhaynes.org,111473,,0AHZG-qV0huDxUk9PVA
1Grazb2YuSbUf5J8XZPfnRxdI87M522A_sHe0yyxhY9c,IC - GC,/My Drive/IC - GC,application/vnd.google-apps.document,2025-09-22T13:02:54.640Z,pcuenco@elhaynes.org,149910,,0AHZG-qV0huDxUk9PVA
1MnJGr6RKAmM1eVIMcRb6Y-o4VRA_khkK,IT Operations,/My Drive/IT Operations,application/vnd.google-apps.site,2025-09-17T14:07:41.628Z,pcuenco@elhaynes.org,19055,,0AHZG-qV0huDxUk9PVA
1tdwULmqUoesueZfmbjmRCGF-4jwyXUq5XawE7eX-4ZQ,25-26 Readiness,/My Drive/25-26 Readiness,application/vnd.google-apps.document,2025-09-08T18:19:03.684Z,pcuenco@elhaynes.org,2122,,0AHZG-qV0huDxUk9PVA
1lH7BFlRm6tI5Xr1sj_ykOv_XepI5yk481Xjm0U339N8,Untitled document,/My Drive/Untitled document,application/vnd.google-apps.document,2025-08-25T13:21:32.565Z,pcuenco@elhaynes.org,76066,,0AHZG-qV0huDxUk9PVA
1BfvLha3WJodcEUmVOiwvJJ20fpzMnkqCTqN4UwFT2cI,Jose documentation,/My Drive/Jose documentation,application/vnd.google-apps.document,2025-08-20T12:38:04.366Z,pcuenco@elhaynes.org,77444,,0AHZG-qV0huDxUk9PVA
1eKb8pEHKgr2xDqiagP2XQOXk0iCKRlJtP-62S5rfP-Q,BoY Assessment Schedule,/My Drive/BoY Assessment Schedule,application/vnd.google-apps.spreadsheet,2025-08-13T15:29:02.674Z,pcuenco@elhaynes.org,1024,,0AHZG-qV0huDxUk9PVA
1HejV8YidehNe1LCDiGAvy1aprItHK_-YgpFa56tgZfs,Untitled spreadsheet,/My Drive/Untitled spreadsheet,application/vnd.google-apps.spreadsheet,2025-08-13T15:01:42.281Z,pcuenco@elhaynes.org,2860,,0AHZG-qV0huDxUk9PVA
1dwQSGUTx5cEOXFHo80VYYtnf22kKMi5nHQ7PYvbFxQc,MS Carts,/My Drive/MS Carts,application/vnd.google-apps.spreadsheet,2025-08-13T14:18:25.640Z,pcuenco@elhaynes.org,1024,,0AHZG-qV0huDxUk9PVA
1dlHUIg2gJ5yKbteOq0MOz8efOOuyjMrddFTaaSezaEk,MS List Serve,/My Drive/MS List Serve,application/vnd.google-apps.spreadsheet,2025-08-11T19:59:25.036Z,pcuenco@elhaynes.org,1395,,0AHZG-qV0huDxUk9PVA
16kjGXHqTZRmzNFFhmWiNkNl_1e1qPE_CI5I7GH-Ates,IT INFO Sec,/My Drive/IT INFO Sec,application/vnd.google-apps.presentation,2025-08-11T17:12:44.182Z,pcuenco@elhaynes.org,13121578,,0AHZG-qV0huDxUk9PVA
17Y6Ztlno8OS196UhsCyHsYym8AAhgick,IT INFO Sec.pptx,/My Drive/IT INFO Sec.pptx,application/vnd.openxmlformats-officedocument.presentationml.presentation,2025-08-10T23:29:04.692Z,pcuenco@elhaynes.org,14748742,,0AHZG-qV0huDxUk9PVA
1OAUjgTotSpzcVjYGXGmnkPPO1QvlmSTJyO2_up_9aLs,IT INFO Sec,/My Drive/IT INFO Sec,application/vnd.google-apps.presentation,2025-08-08T16:06:17.636Z,pcuenco@elhaynes.org,13121564,,0AHZG-qV0huDxUk9PVA
1ydgFYUWlLPIuf12ogjp_3Y2dsmdCV-GN7r_NuURyBIM,GA QR,/My Drive/GA QR,application/vnd.google-apps.document,2025-08-05T13:01:39.119Z,pcuenco@elhaynes.org,3948,,0AHZG-qV0huDxUk9PVA
1HaauH32t2Wnc69I6bGalsXTCQq-xQ8ReUnTLb6yxO3Q,KS QR Code,/My Drive/KS QR Code,application/vnd.google-apps.document,2025-08-05T12:55:53.071Z,pcuenco@elhaynes.org,3956,,0AHZG-qV0huDxUk9PVA
18qoZAN75LRQdmPHrm23Hk5nmpHK-GiuLIOdRXDgAYAw,Tasks Week of [7/28],/My Drive/Tasks Week of [7/28],application/vnd.google-apps.spreadsheet,2025-08-04T19:14:37.821Z,pcuenco@elhaynes.org,1638,,0AHZG-qV0huDxUk9PVA
1K8y5ZUIGnPRsyf7WoaMO_y48FEhD3Jqn,New AD Students Accounts 6-30-2025 (1).xlsx,/My Drive/New AD Students Accounts 6-30-2025 (1).xlsx,application/vnd.openxmlformats-officedocument.spreadsheetml.sheet,2025-08-01T16:50:22.000Z,pcuenco@elhaynes.org,21952,,0AHZG-qV0huDxUk9PVA
14r9B9y-Nvp00CLhaeMT897ztcUf_CEeTdW9ezLkn7D0,HD form (Responses),/My Drive/HD form (Responses),application/vnd.google-apps.spreadsheet,2025-07-29T17:44:24.140Z,pcuenco@elhaynes.org,1024,,0AHZG-qV0huDxUk9PVA
1on6QfG_Wi2kcdyAJT_GnJ0zMbkhSxjyeBrRYk0zVAgI,Untitled form,/My Drive/Untitled form,application/vnd.google-apps.form,2025-07-29T16:50:57.265Z,pcuenco@elhaynes.org,1024,,0AHZG-qV0huDxUk9PVA
1jQLuIUQ1W3lC2CWFVPKAE62ppmWzIDgmG-rw3U7oD-k,QR Code HelpDesk:,/My Drive/QR Code HelpDesk:,application/vnd.google-apps.document,2025-07-29T16:35:37.762Z,pcuenco@elhaynes.org,87036,,0AHZG-qV0huDxUk9PVA
1Big8DqTn3t79DAqFlTJ9oNYqRqUQ_fiX,ELH-LicenseKeys_7_28_2025_9_05_13 PM.csv,/My Drive/ELH-LicenseKeys_7_28_2025_9_05_13 PM.csv,text/csv,2025-07-29T02:21:52.000Z,pcuenco@elhaynes.org,13073,,0AHZG-qV0huDxUk9PVA
19AiAXyYIhFUzJeQhfMibhYdjk6ZAuOuYMTLVzUtKKO4,Google Classroom Pre-Survey (Admins) (Responses),/My Drive/Google Classroom Pre-Survey (Admins) (Responses),application/vnd.google-apps.spreadsheet,2025-07-25T19:43:27.465Z,pcuenco@elhaynes.org,2562,,0AHZG-qV0huDxUk9PVA
1hHhPyoI7NTRvTeKTQ1fUrWEJ-G1BbjICTZTzeYMt03o,Tasks Week of [7/21],/My Drive/Tasks Week of [7/21],application/vnd.google-apps.spreadsheet,2025-07-25T18:53:33.940Z,pcuenco@elhaynes.org,1024,,0AHZG-qV0huDxUk9PVA
1te9OmXP2g-be6Zk4psDxTAyCzPfl-a0RO2cJFBzg9iI,Exited students - working,/My Drive/Exited students - working,application/vnd.google-apps.spreadsheet,2025-07-25T18:23:26.141Z,pcuenco@elhaynes.org,32509,,0AHZG-qV0huDxUk9PVA
11AMAwCx3T2t0xGrW05AOspASMUgLS1q6AtvbXfvBu9o,SY25-26 Tech Device Deployment & Purchase,/My Drive/SY25-26 Tech Device Deployment & Purchase,application/vnd.google-apps.presentation,2025-07-25T12:56:47.673Z,pcuenco@elhaynes.org,771841,,0AHZG-qV0huDxUk9PVA
1cfWqsoE1YzP67h_k5zaR2n84dxkoOtNvmcAATdUixI4,6th Grade Roster,/My Drive/6th Grade Roster,application/vnd.google-apps.spreadsheet,2025-07-25T11:35:15.156Z,pcuenco@elhaynes.org,4276,,0AHZG-qV0huDxUk9PVA
1cn0Pce-F9MY-ikS-e0fnb3EJqBCoQ_CtZOCIVBIoZUc,Audit - Stephanie,/My Drive/Audit - Stephanie,application/vnd.google-apps.document,2025-07-23T19:16:10.981Z,pcuenco@elhaynes.org,1234630,,0AHZG-qV0huDxUk9PVA
1VUIr7rew04iO88LzsfW6E52UEb57WmJlhCSlkY6rbU4,Google Classroom Pre-Survey (Admins),/My Drive/Google Classroom Pre-Survey (Admins),application/vnd.google-apps.form,2025-07-21T17:29:40.917Z,pcuenco@elhaynes.org,2337,,0AHZG-qV0huDxUk9PVA
1fPi_cNcyVTMiEazZxYbM7msG6nei5vUpRJETMNbB2vk,Google Classroom and LMS Training Feedback,/My Drive/Google Classroom and LMS Training Feedback,application/vnd.google-apps.form,2025-07-21T15:44:54.322Z,pcuenco@elhaynes.org,1024,,0AHZG-qV0huDxUk9PVA
1wGgTfgnwvGBgQLVELB9QGKBttB1wJw_XMNfzn4IsYaw,AI Notes,/My Drive/AI Notes,application/vnd.google-apps.document,2025-07-17T17:02:51.588Z,pcuenco@elhaynes.org,1024,,0AHZG-qV0huDxUk9PVA
11Dery9-NcwWrXVE14iZ9v4KsXAY9ypQvyvYC1ri5NwY,IT Team Slide Template,/My Drive/IT Team Slide Template,application/vnd.google-apps.document,2025-07-15T20:31:24.435Z,pcuenco@elhaynes.org,4009,,0AHZG-qV0huDxUk9PVA
1I0g0Qus1UCesn27pZMQ44mqkYAQo5bwuy44ZUoy3cgo,IT Team,/My Drive/IT Team,application/vnd.google-apps.document,2025-07-15T20:30:43.252Z,pcuenco@elhaynes.org,2607,,0AHZG-qV0huDxUk9PVA
1DguXu4BbNEvssNOZ_sRq4LZdFhvCWgmUdNfSywSXFmQ,9th Grade Roster,/My Drive/9th Grade Roster,application/vnd.google-apps.spreadsheet,2025-07-15T14:05:51.695Z,pcuenco@elhaynes.org,4632,,0AHZG-qV0huDxUk9PVA
1YBzPaGyEORmhZFCJ5Xe3UUbquIQ6QQeB_UCfC6wxUQ8,Mike and Jose 2nd incident meeting,/My Drive/Mike and Jose 2nd incident meeting,application/vnd.google-apps.document,2025-07-11T14:43:03.727Z,pcuenco@elhaynes.org,3234,,0AHZG-qV0huDxUk9PVA
1BQdPETu5GLQYClELmrHMj2JT-ZBC4-dHOsaSC-F1HZ4,exited students,/My Drive/exited students,application/vnd.google-apps.spreadsheet,2025-07-10T17:49:09.438Z,pcuenco@elhaynes.org,10456,,0AHZG-qV0huDxUk9PVA
1c_fEzV_3S8CXqw5m53THarLAqaR_v7jbhYcyTv-tCeo,Mike/Jose:,/My Drive/Mike/Jose:,application/vnd.google-apps.document,2025-07-02T19:25:22.183Z,pcuenco@elhaynes.org,2060,,0AHZG-qV0huDxUk9PVA
13pkTwlk8MacWrx_FWSCmCBJjKU5XzazY,New AD Students Accounts 6-30-2025.xlsx,/My Drive/New AD Students Accounts 6-30-2025.xlsx,application/vnd.openxmlformats-officedocument.spreadsheetml.sheet,2025-06-30T16:48:52.000Z,pcuenco@elhaynes.org,21952,,0AHZG-qV0huDxUk9PVA
1yF4Uuy3vtrTUED6YDC29DE2-djG6PCbX,PO ANYWHERE.pdf,/My Drive/PO ANYWHERE.pdf,application/pdf,2025-06-20T15:38:21.000Z,pcuenco@elhaynes.org,72889,,0AHZG-qV0huDxUk9PVA
1tUwpaF8qq_bsP6zsVdZznOPcwpnbVMauoDJqwtKmt78,Staff to exited OU,/My Drive/Staff to exited OU,application/vnd.google-apps.spreadsheet,2025-06-11T14:16:30.762Z,pcuenco@elhaynes.org,2134,,0AHZG-qV0huDxUk9PVA
13AodEAzuu0U_UPsc2JTRRaVCoyAZG0sYX8zXgt1Desw,Job Description - Technology Intern,/My Drive/Job Description - Technology Intern,application/vnd.google-apps.document,2025-06-10T13:38:15.087Z,pcuenco@elhaynes.org,19293,,0AHZG-qV0huDxUk9PVA
1kWa8KoiPbJBTIUqIMJVpOZjk-TGaO-9Y,Job Description - Technology Intern.pdf,/My Drive/Job Description - Technology Intern.pdf,application/pdf,2025-06-10T13:30:16.000Z,pcuenco@elhaynes.org,94300,,0AHZG-qV0huDxUk9PVA
1BvsZ6Q6DaqsKEmAfGsPoHYRzX0eVDupGXXX3-uhJT7M,AI Cheat Sheet,/My Drive/AI Cheat Sheet,application/vnd.google-apps.document,2025-06-04T15:32:37.649Z,pcuenco@elhaynes.org,2058,,0AHZG-qV0huDxUk9PVA
1s13iRN59EjnImYnlAXkmhzkjoZaa3SRy4T6HSveynt0,Monthly Lost Laptop Report,/My Drive/Monthly Lost Laptop Report,application/vnd.google-apps.spreadsheet,2025-06-03T14:24:00.093Z,pcuenco@elhaynes.org,9176,,0AHZG-qV0huDxUk9PVA
1rqm8_JA0GnJ8npQzc-r6LvPCkwA_IAxOcFpbTExyu8Y,CRPCS Interviews,/My Drive/CRPCS Interviews,application/vnd.google-apps.document,2025-05-30T15:18:36.335Z,pcuenco@elhaynes.org,2096,,0AHZG-qV0huDxUk9PVA
13KQdIT13UIF60a8dYD7sDNtMrLYJgb0oZiCGbvDx0O0,[PROCEDURE] Youtube Livestream,/My Drive/[PROCEDURE] Youtube Livestream,application/vnd.google-apps.document,2025-05-28T20:11:22.520Z,pcuenco@elhaynes.org,11132,,0AHZG-qV0huDxUk9PVA
1N8pLRiu1Q6hO4oV8hvW8CtKd6Q4Plm3J,ELH CBs.xlsx,/My Drive/ELH CBs.xlsx,application/vnd.openxmlformats-officedocument.spreadsheetml.sheet,2025-05-28T16:54:21.000Z,pcuenco@elhaynes.org,14198,,0AHZG-qV0huDxUk9PVA
1LdS-GSjZytXBskOXqPzZBZNFT4cr1PY1nT-C7rUGp54,[Meeting Notes] Python Server:,/My Drive/[Meeting Notes] Python Server:,application/vnd.google-apps.document,2025-05-28T13:11:08.786Z,pcuenco@elhaynes.org,1024,,0AHZG-qV0huDxUk9PVA
1TM5g30bKCKlFO74Qcjnq-ahEThcRlUVqnGk0KwNFtos,All Staff Email Restrictions,/My Drive/All Staff Email Restrictions,application/vnd.google-apps.document,2025-05-21T14:13:45.438Z,pcuenco@elhaynes.org,47369,,0AHZG-qV0huDxUk9PVA
1fUFXoa388ltS73x9P2ulFF-z5L6lyDFUZIU6uDCIOnw,Assessment Post Mortem Review,/My Drive/Assessment Post Mortem Review,application/vnd.google-apps.document,2025-05-15T19:15:49.187Z,pcuenco@elhaynes.org,3457,,0AHZG-qV0huDxUk9PVA
19F2HJkmHKlh4aOY6V3YWWXCbamtTWYSlRHd-xPwXpWUBwRtSgKjXn_9e5SicJgo7Fj82lpup,Classroom,/My Drive/Classroom,application/vnd.google-apps.folder,2025-05-14T20:14:41.579Z,pcuenco@elhaynes.org,,,0AHZG-qV0huDxUk9PVA
1oQ2i3TQZaC2Vof2jY1iuGs_bJB7GszQJ3HHqPpq_LnU,Untitled spreadsheet,/My Drive/Untitled spreadsheet,application/vnd.google-apps.spreadsheet,2025-05-14T20:12:49.430Z,pcuenco@elhaynes.org,1889,,0AHZG-qV0huDxUk9PVA
1ktglcKE-U_csMB_GrNnWgwlGRkWe49523N75jA36gW4,[5/12/2025] Staff Institute Planning:,/My Drive/[5/12/2025] Staff Institute Planning:,application/vnd.google-apps.document,2025-05-12T19:36:03.483Z,pcuenco@elhaynes.org,1024,,0AHZG-qV0huDxUk9PVA
1GwWBx9tbFzW1qRKbp9r-wbnpJngAWc6pcXkYTJSNLJY,"[LOCAL] 2025 Summer Facilities, Maintenance & IT Projects","/My Drive/[LOCAL] 2025 Summer Facilities, Maintenance & IT Projects",application/vnd.google-apps.spreadsheet,2025-05-12T14:29:28.731Z,pcuenco@elhaynes.org,5539,,0AHZG-qV0huDxUk9PVA
1c8JkQvLoffWfJxEtdUiUXwBggO3q19vEGnpy3SsQIvU,CAPE 2025 Coverage,/My Drive/CAPE 2025 Coverage,application/vnd.google-apps.spreadsheet,2025-05-12T13:15:09.478Z,pcuenco@elhaynes.org,1024,,0AHZG-qV0huDxUk9PVA
1qxuIvLybSK1-Zw8_wDG0H67X8hV0NXiwURgYeXR0d1s,ELH-WELCOME+SSID+Report,/My Drive/ELH-WELCOME+SSID+Report,application/vnd.google-apps.spreadsheet,2025-05-08T19:07:35.852Z,pcuenco@elhaynes.org,13608,,0AHZG-qV0huDxUk9PVA
1XhCILfmxAxPQy_u7nrGRjYqQePHNQYSz,ELH-WELCOME+SSID+Report.csv,/My Drive/ELH-WELCOME+SSID+Report.csv,text/csv,2025-05-08T18:52:42.000Z,pcuenco@elhaynes.org,73244,,0AHZG-qV0huDxUk9PVA
1cQOjpnOmSuOCqAHfoup5rtha90lksXrjEYKZbNLzhJ8,Google Workspace Links,/My Drive/Google Workspace Links,application/vnd.google-apps.document,2025-04-25T14:00:08.813Z,pcuenco@elhaynes.org,2164,,0AHZG-qV0huDxUk9PVA
1Is75pwuh8e0HLbd77VmeX5402zvn-PZLX9IGqZ1TrHI,Google Workspace Upgrade,/My Drive/Google Workspace Upgrade,application/vnd.google-apps.presentation,2025-04-24T13:35:09.531Z,pcuenco@elhaynes.org,626923,,0AHZG-qV0huDxUk9PVA
1aPKRRxaFd4uBEmstrRaY2NehUwWKLRZ0,BoY.drawio,/My Drive/BoY.drawio,application/vnd.jgraph.mxfile,2025-04-14T18:52:42.471Z,pcuenco@elhaynes.org,10684,,0AHZG-qV0huDxUk9PVA
1i9_jS14eF_Zl73HTRuHX3pzLzKdI5OrA1OtndP9tMYA,[PROCEDURE] User Enrollment to Google 2FA,/My Drive/[PROCEDURE] User Enrollment to Google 2FA,application/vnd.google-apps.document,2025-04-14T18:13:36.682Z,pcuenco@elhaynes.org,2167,,0AHZG-qV0huDxUk9PVA
1trm4RUuxNbN3vsh1NOiTdgLNrRcKjxFQbeVm99LlCPg,BoY Tracker,/My Drive/BoY Tracker,application/vnd.google-apps.spreadsheet,2025-04-14T14:03:47.589Z,pcuenco@elhaynes.org,1024,,0AHZG-qV0huDxUk9PVA
1YHax2uUtoUfx8Yu65ZvlZ7ulwwcNfdwW,Meeting Reports,/My Drive/Meeting Reports,application/vnd.google-apps.folder,2025-04-10T18:30:44.704Z,pcuenco@elhaynes.org,,,0AHZG-qV0huDxUk9PVA
1Bpl-y__WNPfJznvpRBQCNw_6M_JuaXulnSjUmzLI130,CB and Laptop Bids,/My Drive/CB and Laptop Bids,application/vnd.google-apps.spreadsheet,2025-04-09T20:23:49.162Z,pcuenco@elhaynes.org,1024,,0AHZG-qV0huDxUk9PVA
1TDpmll_0zQPDWDG51EwRCqFbBjxlPj-7OijMXbTEWtSLhrzZxMreahvc,CalendarBot2,/My Drive/CalendarBot2,application/vnd.google-apps.script,2025-04-09T16:54:51.709Z,pcuenco@elhaynes.org,,,0AHZG-qV0huDxUk9PVA
1S7fZXOoroyEkHvHrI4w_J5W5CYDXpjnlQYIgKOivXPve3Bzg9-vZ2ktW,CalendarBot,/My Drive/CalendarBot,application/vnd.google-apps.script,2025-04-09T16:29:34.878Z,pcuenco@elhaynes.org,,,0AHZG-qV0huDxUk9PVA
1pXrIAVh__Em2epijx9tw13iP3t1kZmMolW5HXtFZIzhkm9jhc2l4kPrP,Untitled project,/My Drive/Untitled project,application/vnd.google-apps.script,2025-04-09T15:21:11.577Z,pcuenco@elhaynes.org,,,0AHZG-qV0huDxUk9PVA
1tyTqm9FzJGN_kFCtSKD4b-Pr6qwba8K_DIGHGhYwS-g3kArzkGHGfccg,ELH-Chat,/My Drive/ELH-Chat,application/vnd.google-apps.script,2025-04-09T13:21:05.756Z,pcuenco@elhaynes.org,,,0AHZG-qV0huDxUk9PVA
16QWPmgGQDSE3b9Y24cY-VwT1Ik_V3QWomY6C1NobNqVhMwbnkyF1oaWj,Untitled project,/My Drive/Untitled project,application/vnd.google-apps.script,2025-04-08T19:55:22.460Z,pcuenco@elhaynes.org,,,0AHZG-qV0huDxUk9PVA
1-n625lGLVes7WO1bXTyaY902vHnMIRoOeYFRyx9SbfnA9BafKeqGjzfC,Untitled project,/My Drive/Untitled project,application/vnd.google-apps.script,2025-04-08T19:45:40.850Z,pcuenco@elhaynes.org,,,0AHZG-qV0huDxUk9PVA
1h7ImOii2JJEX-wAHsB7DVQC_iX4WE_-0yTDnH4MOIss,Google Education Plus Users,/My Drive/Google Education Plus Users,application/vnd.google-apps.spreadsheet,2025-04-07T20:19:42.788Z,pcuenco@elhaynes.org,1024,,0AHZG-qV0huDxUk9PVA
1Dv_7sFwxdCiVCbGcLx-9LEE7ec-Soi7h,Meet Recordings,/My Drive/Meet Recordings,application/vnd.google-apps.folder,2025-04-07T19:40:00.278Z,pcuenco@elhaynes.org,,,0AHZG-qV0huDxUk9PVA
14m56FseEcMtXg-T1c0fDm_uxT3p3nxCV8RfKHEjjkjg,Events w/ Rasheed,/My Drive/Events w/ Rasheed,application/vnd.google-apps.document,2025-04-02T15:13:11.766Z,pcuenco@elhaynes.org,1024,,0AHZG-qV0huDxUk9PVA
1oQYxFHYw_ZdsUFEgZHb93919-b9U1dWO,Complete_with_Docusign_ELHaynes_SOA_765345_2.pdf,/My Drive/Complete_with_Docusign_ELHaynes_SOA_765345_2.pdf,application/pdf,2025-04-02T14:10:06.756Z,pcuenco@elhaynes.org,285405,,0AHZG-qV0huDxUk9PVA
11HbOCWjRp3-OtNqzLhZa-uyzJNaQfSxhKytBjLrE7jI,Additional Tech Questions:,/My Drive/Additional Tech Questions:,application/vnd.google-apps.document,2025-03-28T14:15:29.124Z,pcuenco@elhaynes.org,2121,,0AHZG-qV0huDxUk9PVA
1bver3LiLZ5mzLCHVwqeILC-2KPq6CXIW6D3j6xPW7_E,Terminated_Employee_Checklist,/My Drive/Terminated_Employee_Checklist,application/vnd.google-apps.spreadsheet,2025-03-21T12:49:05.293Z,pcuenco@elhaynes.org,1024,,0AHZG-qV0huDxUk9PVA
12pYKDz07DxbwGs5oE0aXS8TsfxG-bCmf,Terminated_Employee_Checklist.csv,/My Drive/Terminated_Employee_Checklist.csv,text/csv,2025-03-20T16:27:02.000Z,pcuenco@elhaynes.org,345,,0AHZG-qV0huDxUk9PVA
1F0XUwFaiq4Km1WvurjMVapCOXzX_-1P4,Cuenco BitLocker Recovery Key 268D0EA9-2F8B-4551-894A-96233FC9E149.TXT,/My Drive/Cuenco BitLocker Recovery Key 268D0EA9-2F8B-4551-894A-96233FC9E149.TXT,text/plain,2025-03-20T13:42:59.425Z,pcuenco@elhaynes.org,1348,,0AHZG-qV0huDxUk9PVA
1gPXlFHLAye1zZLAKp7zcLn4wL74LxsS5,jumpcloud.txt,/My Drive/jumpcloud.txt,text/plain,2025-03-11T19:38:11.329Z,pcuenco@elhaynes.org,207,,0AHZG-qV0huDxUk9PVA
1Gf0-KnCU97-0VtBcUZejazb_PESO6OF9paq9IVrq3NQ,Bid Matrix - Erate,/My Drive/Bid Matrix - Erate,application/vnd.google-apps.spreadsheet,2025-03-11T13:54:16.081Z,pcuenco@elhaynes.org,3358,,0AHZG-qV0huDxUk9PVA
1iNgxTOgMSAG3wkV5ZHbCKnAuL0YYVb9rEqLEnm6EyMo,ES,/My Drive/ES,application/vnd.google-apps.spreadsheet,2025-03-04T17:52:23.542Z,pcuenco@elhaynes.org,5990,,0AHZG-qV0huDxUk9PVA
1AlYbUGX4CSeqAmtSfTLYavrgtq--mNobRS0AHTnOmjM,HS,/My Drive/HS,application/vnd.google-apps.spreadsheet,2025-03-04T17:51:24.228Z,pcuenco@elhaynes.org,10236,,0AHZG-qV0huDxUk9PVA
1TwPV_xreSqUZm0H2ehl0ezNM6ZAHMjD9,ES.csv,/My Drive/ES.csv,text/csv,2025-03-04T17:43:39.000Z,pcuenco@elhaynes.org,27075,,0AHZG-qV0huDxUk9PVA
1s0GbCBtCGklryZ9apNgvyI1ZAsegBGnq,HS.csv,/My Drive/HS.csv,text/csv,2025-03-04T17:43:39.000Z,pcuenco@elhaynes.org,52162,,0AHZG-qV0huDxUk9PVA
1Z2avc2W8x2GII2MQBSACW5e71Q0qLf00hFwzB_4Objo,Untitled spreadsheet,/My Drive/Untitled spreadsheet,application/vnd.google-apps.spreadsheet,2025-03-03T17:28:42.257Z,pcuenco@elhaynes.org,10688,,0AHZG-qV0huDxUk9PVA
1qHM0n8DHJIrAvIWeV9THpx48wkhOi-fQkXdNUTd2so4,Hilary sent email to all.staff,/My Drive/Hilary sent email to all.staff,application/vnd.google-apps.spreadsheet,2025-02-27T18:50:33.639Z,pcuenco@elhaynes.org,3146,,0AHZG-qV0huDxUk9PVA
1lKbvepHohUmZ5eBEL8qFZtZVl1WDWK6I_GmJzVse2tY,Egypt,/My Drive/Egypt,application/vnd.google-apps.document,2025-02-25T20:09:42.341Z,pcuenco@elhaynes.org,225217,,0AHZG-qV0huDxUk9PVA
11Gdnz4zq-acA6T-35c7ZirxNedOmrvgl,Tickets.pdf,/My Drive/Tickets.pdf,application/pdf,2025-02-25T15:55:22.338Z,pcuenco@elhaynes.org,47931,,0AHZG-qV0huDxUk9PVA
1fKWJEPbFbsUP-Ri83IUcf5yu6Vm_ZqhKHTazIAP6jYY,Access Coverage,/My Drive/Access Coverage,application/vnd.google-apps.spreadsheet,2025-02-20T20:40:49.182Z,pcuenco@elhaynes.org,1024,,0AHZG-qV0huDxUk9PVA
17u8iw1FtuBKD7XFYtUybZAzWYO-b3bRmH4FiTAUX3jE,Untitled document,/My Drive/Untitled document,application/vnd.google-apps.document,2025-02-19T15:17:11.821Z,pcuenco@elhaynes.org,1024,,0AHZG-qV0huDxUk9PVA
1dhAsBvOcH29sWstwFrRN_CLvImmPewGM_IA6DjQUqBM,Proposal_Lead Technican,/My Drive/Proposal_Lead Technican,application/vnd.google-apps.document,2025-02-18T20:21:57.082Z,pcuenco@elhaynes.org,4177,,0AHZG-qV0huDxUk9PVA
1_LOZdPgqZ0xlLzgAqPSSKGNRfiFVd_A8plHBbAtz6Ps,Christian 02-18,/My Drive/Christian 02-18,application/vnd.google-apps.document,2025-02-18T19:13:05.193Z,pcuenco@elhaynes.org,15673,,0AHZG-qV0huDxUk9PVA
1sPbsTVcjKitE-rEcD0GNGumC9qEqEnCurxO8jOreiOY,ERATE Bids,/My Drive/ERATE Bids,application/vnd.google-apps.spreadsheet,2025-02-18T14:49:13.753Z,pcuenco@elhaynes.org,2133,,0AHZG-qV0huDxUk9PVA
1xSqUg6eYg2T28VF4YRDNrcgjCBwlN-ycdMPe7shjjV8,ELH-DNS,/My Drive/ELH-DNS,application/vnd.google-apps.document,2025-02-13T15:54:16.716Z,pcuenco@elhaynes.org,2062,,0AHZG-qV0huDxUk9PVA
1RaIxCaU5iFZvcxoQ-CpNoMqzfPBk32Jrt0WXO5L2kX0,DNS Tech Review:,/My Drive/DNS Tech Review:,application/vnd.google-apps.document,2025-02-10T20:29:55.548Z,pcuenco@elhaynes.org,1024,,0AHZG-qV0huDxUk9PVA
1KEpg4GaY5YuKc4HepOzERPk2Y1QKApjsW4r_TxIbhjw,Pivot,/My Drive/Pivot,application/vnd.google-apps.spreadsheet,2025-02-07T21:12:19.092Z,pcuenco@elhaynes.org,1024,,0AHZG-qV0huDxUk9PVA
1QqqvMcKODw30a4Y33VoZCkZWcLo9b5c3VPCyzwnbP9A,Incident IQ:,/My Drive/Incident IQ:,application/vnd.google-apps.document,2025-02-07T17:30:59.000Z,pcuenco@elhaynes.org,1024,,0AHZG-qV0huDxUk9PVA
17-dy7FUff03rCjGv5aaX2INzj85dI0Kn,Scripts,/My Drive/Scripts,application/vnd.google-apps.folder,2025-02-05T16:57:11.316Z,pcuenco@elhaynes.org,,,0AHZG-qV0huDxUk9PVA
1J9r4GFfFp48tPtQj1OtGxhoSVERq82Vy,MS Assessement Cart Repetive Offenders v1.xlsx,/My Drive/MS Assessement Cart Repetive Offenders v1.xlsx,application/vnd.openxmlformats-officedocument.spreadsheetml.sheet,2025-02-05T16:35:09.000Z,pcuenco@elhaynes.org,12589,,0AHZG-qV0huDxUk9PVA
1kmVJ1mQFbYeGs6pAvVbgvbUTEQviTHlw,ConnectWise.drawio,/My Drive/ConnectWise.drawio,application/vnd.jgraph.mxfile,2025-02-04T15:00:13.918Z,pcuenco@elhaynes.org,8421,,0AHZG-qV0huDxUk9PVA
1XWn7ruIuEgB9dDo6y33ASyUbIOuYtP_oet3F9cJaN4Y,Jose - incident with Mike 1-28,/My Drive/Jose - incident with Mike 1-28,application/vnd.google-apps.document,2025-01-30T20:14:08.598Z,pcuenco@elhaynes.org,2065,,0AHZG-qV0huDxUk9PVA
1_BgGkMf3maaQMpANgwP2E2xDOrWrV1hYgg9xd4QRLKc,IT Operations,/My Drive/IT Operations,application/vnd.google-apps.presentation,2025-01-17T17:28:30.799Z,pcuenco@elhaynes.org,4849,,0AHZG-qV0huDxUk9PVA
1d11v5RYnv92jWvvXI_frIwfn--jCp2ik,Events.drawio,/My Drive/Events.drawio,application/vnd.jgraph.mxfile,2025-01-16T19:28:20.788Z,pcuenco@elhaynes.org,14035,,0AHZG-qV0huDxUk9PVA
1qeK5ZxktBJiy8NVC_rfVX1wA3eqONXRMzBiS0XMaxZ0,Test form approval (Responses),/My Drive/Test form approval (Responses),application/vnd.google-apps.spreadsheet,2025-01-12T17:42:37.380Z,pcuenco@elhaynes.org,2730,,0AHZG-qV0huDxUk9PVA
1lCJjIrD9xkxXkCjfHyEKQFyZA8eGgpQ0,ActivatedPhones.xls,/My Drive/ActivatedPhones.xls,application/vnd.ms-excel,2025-01-12T06:00:25.000Z,pcuenco@elhaynes.org,5632,,0AHZG-qV0huDxUk9PVA
1s6zRqstbdnY3d-Ha8EEuoK9XMMkPMcFUHLJQTOmL7aI,E.L. Haynes August to October 2024 Usage,/My Drive/E.L. Haynes August to October 2024 Usage,application/vnd.google-apps.spreadsheet,2025-01-03T17:02:15.495Z,pcuenco@elhaynes.org,3479,,0AHZG-qV0huDxUk9PVA
1-LfY7U5Ut1U8o7zthZCU40e-8WCDKbxr,User Deletions,/My Drive/User Deletions,application/vnd.google-apps.folder,2025-01-03T16:48:16.334Z,pcuenco@elhaynes.org,,,0AHZG-qV0huDxUk9PVA
0B3ZG-qV0huDxfkhWRlJ4SXFmNG9pVGdYTTFTWFVPSDJpLTZ5ZG9EY2dvNnlWZXVjSHBhR2s,Google Admin Downloads,/My Drive/Google Admin Downloads,application/vnd.google-apps.folder,2024-12-20T18:36:26.357Z,pcuenco@elhaynes.org,,,0AHZG-qV0huDxUk9PVA
1j0Kq8GOT8Hg4rdf0HWeRuxkxmYUTYXrAEUxSoLhuOF0,Untitled form,/My Drive/Untitled form,application/vnd.google-apps.form,2024-12-19T20:38:57.071Z,pcuenco@elhaynes.org,1024,,0AHZG-qV0huDxUk9PVA
1CAgI-rvSy3AI2dTUHhQSTjD1tN5dXKcu7_hGBeB75Tc,To Calendar (Responses),/My Drive/To Calendar (Responses),application/vnd.google-apps.spreadsheet,2024-12-19T20:18:10.338Z,pcuenco@elhaynes.org,3313,,0AHZG-qV0huDxUk9PVA
1ieYdgTSokCxHHGIvPbKDb5JDkJ27z29t,Virtus Fillable Reference Check Form - St. Louis School (1) (1) (2).pdf,/My Drive/Virtus Fillable Reference Check Form - St. Louis School (1) (1) (2).pdf,application/pdf,2024-12-13T19:36:03.000Z,pcuenco@elhaynes.org,807563,,0AHZG-qV0huDxUk9PVA
1RMoePQwwX_XxF8wq6emgS28kPqDMhOU0,Assessments,/My Drive/Assessments,application/vnd.google-apps.folder,2024-12-13T17:42:33.255Z,pcuenco@elhaynes.org,,,0AHZG-qV0huDxUk9PVA
15MHBbCU4UoPiCgKJA65rYUeXizdVeHDBjCiON5ud2qg,Untitled form (Responses),/My Drive/Untitled form (Responses),application/vnd.google-apps.spreadsheet,2024-12-13T14:02:41.427Z,pcuenco@elhaynes.org,1024,,0AHZG-qV0huDxUk9PVA
1dC9xVHp-wA5WJDA5T1S6_c3tvONcZL1wyFAA3sX4NvM,Untitled form,/My Drive/Untitled form,application/vnd.google-apps.form,2024-12-13T14:02:12.138Z,pcuenco@elhaynes.org,1024,,0AHZG-qV0huDxUk9PVA
1UWiFBnt3fYQONCssVzTFCt4GIBHy50Nm,Reports,/My Drive/Reports,application/vnd.google-apps.folder,2024-12-11T14:04:44.929Z,pcuenco@elhaynes.org,,,0AHZG-qV0huDxUk9PVA
1A_FBryH-lbCkLWrdDxuTXpXSqgoq_xVxkbbv0rsIPok,IT Ops Schedule and Dates,/My Drive/IT Ops Schedule and Dates,application/vnd.google-apps.spreadsheet,2024-12-10T15:59:03.701Z,pcuenco@elhaynes.org,3772,,0AHZG-qV0huDxUk9PVA
18DxhS5X1pSwZoXeZAxBKvW3Hp0WV5rQt,E.L. Haynes Community Survey - Fall 2024 DRAFT 2 (3).pptx,/My Drive/E.L. Haynes Community Survey - Fall 2024 DRAFT 2 (3).pptx,application/vnd.openxmlformats-officedocument.presentationml.presentation,2024-12-06T14:38:16.000Z,pcuenco@elhaynes.org,4803431,,0AHZG-qV0huDxUk9PVA
1ZTVyAprZsCiwtvNNZXwuQX26zGroIdosECPQ5EHJz1s,TMobile Check,/My Drive/TMobile Check,application/vnd.google-apps.spreadsheet,2024-12-04T15:14:42.108Z,pcuenco@elhaynes.org,1024,,0AHZG-qV0huDxUk9PVA
1HoeE7ZChdL8IXNxFz5XXMDM8I8uM41yH_qD4OAECeSo,Server Racks,/My Drive/Server Racks,application/vnd.google-apps.spreadsheet,2024-11-20T15:37:20.090Z,pcuenco@elhaynes.org,6958,,0AHZG-qV0huDxUk9PVA
1-0Fc1kg_H5cmPbz1DBnnY5ite8AfedMn,E.L Haynes IMEI report 11-18-2024.xlsx,/My Drive/E.L Haynes IMEI report 11-18-2024.xlsx,application/vnd.openxmlformats-officedocument.spreadsheetml.sheet,2024-11-18T20:34:08.000Z,pcuenco@elhaynes.org,19943,,0AHZG-qV0huDxUk9PVA
1dgH5jj4czL2j5NktKbQ-i6Et0p97aM0x,E.L. Haynes August to October 2024 Usage.xlsx,/My Drive/E.L. Haynes August to October 2024 Usage.xlsx,application/vnd.openxmlformats-officedocument.spreadsheetml.sheet,2024-11-18T14:28:21.817Z,pcuenco@elhaynes.org,18425,,0AHZG-qV0huDxUk9PVA
1C56eNPwr2GfGdjpx24cRHslDKcl681AVnNZ7XRvuLTE,RISE Goals,/My Drive/RISE Goals,application/vnd.google-apps.document,2024-11-18T14:10:50.977Z,pcuenco@elhaynes.org,1024,,0AHZG-qV0huDxUk9PVA
1yZmAdMBK9rNbJHhcJyksUsy0Mc6QGwk1Hj3KUcuecCI,ERATE - John Beem,/My Drive/ERATE - John Beem,application/vnd.google-apps.document,2024-11-13T16:44:44.715Z,pcuenco@elhaynes.org,2104,,0AHZG-qV0huDxUk9PVA
1XCN0uXFKxO2_e0ZYPH4_x6L_y1b4wJ0FsgCicNyDbpo,Hilary,/My Drive/Hilary,application/vnd.google-apps.document,2024-11-08T20:50:15.727Z,pcuenco@elhaynes.org,1024,,0AHZG-qV0huDxUk9PVA
13J53cGTnV-L4LPdAhUXlapJPHGcW5nQDjEwaStW_iDo,Testing Tech coordinator:,/My Drive/Testing Tech coordinator:,application/vnd.google-apps.document,2024-11-08T18:59:22.258Z,pcuenco@elhaynes.org,1024,,0AHZG-qV0huDxUk9PVA
1Khj1esitjt1bTdPROYRlUoAKYGJ4P0jGH7I1NBeDETM,Zenada/Peter,/My Drive/Zenada/Peter,application/vnd.google-apps.document,2024-11-08T16:38:20.127Z,pcuenco@elhaynes.org,1024,,0AHZG-qV0huDxUk9PVA
1OxYCSRlYpc6lVT6bV5WhNHpbc1ljaZRD,Meeting Notes,/My Drive/Meeting Notes,application/vnd.google-apps.folder,2024-11-08T15:24:10.115Z,pcuenco@elhaynes.org,,,0AHZG-qV0huDxUk9PVA
1IAcGqIVtjjdO7a9q_zzMXGZjk1G-f_r6kDEglLXtW4Y,Standup notes,/My Drive/Standup notes,application/vnd.google-apps.document,2024-11-07T13:54:25.501Z,pcuenco@elhaynes.org,2132,,0AHZG-qV0huDxUk9PVA
1H2mFciZikCpj_vhC-wokUaBcBAC2FZgoHdjeoWAuBMQ,For Zenada [MS],/My Drive/For Zenada [MS],application/vnd.google-apps.document,2024-11-05T19:40:46.355Z,pcuenco@elhaynes.org,1024,,0AHZG-qV0huDxUk9PVA
1IR71uq0DR0qKB6eFWiWUZobZaWcCz_uP,mychart.pdf,/My Drive/mychart.pdf,application/pdf,2024-11-05T13:32:08.000Z,pcuenco@elhaynes.org,242372,,0AHZG-qV0huDxUk9PVA
1964hYyI2lKcWaRnuyOxg6Em5HPqxtz19J5ejSUeudMg,Server Ping Status,/My Drive/Server Ping Status,application/vnd.google-apps.spreadsheet,2024-11-04T15:12:46.923Z,pcuenco@elhaynes.org,1024,,0AHZG-qV0huDxUk9PVA
1_mFNzHkI-R4cthbnDlewg8bcb2_ApbQg,Status page,/My Drive/Status page,application/vnd.google-apps.site,2024-11-04T15:09:44.429Z,pcuenco@elhaynes.org,,,0AHZG-qV0huDxUk9PVA
1L_41Q2a-N-p0ipGrXLPR5wv43x_aTcUblprCmixClVhYmvKhj0-JV5Ls,Status,/My Drive/Status,application/vnd.google-apps.script,2024-11-04T14:59:57.227Z,pcuenco@elhaynes.org,,,0AHZG-qV0huDxUk9PVA
1awr6J0LBJz9yqNSDJFDANcu8ga4o2EV5Jxmk9HHHLVg,30 day goals:,/My Drive/30 day goals:,application/vnd.google-apps.document,2024-10-30T13:05:26.274Z,pcuenco@elhaynes.org,1625,,0AHZG-qV0huDxUk9PVA
1vJILRqBY8rZiuYHIb41o0ZLGLbfZ2Z1Z,Policies,/My Drive/Policies,application/vnd.google-apps.folder,2024-10-29T19:33:16.649Z,pcuenco@elhaynes.org,,,0AHZG-qV0huDxUk9PVA
1QSp5BkbcEh7uy3YgSDDxDeLv0PgTPlFWR2m7CQWxtgo,DevOps in EL Haynes,/My Drive/DevOps in EL Haynes,application/vnd.google-apps.presentation,2024-10-24T14:08:02.130Z,pcuenco@elhaynes.org,4066,,0AHZG-qV0huDxUk9PVA
1lGA1PiMyGzcVZiqZMwKFN4bXUSTiPd7yKyX2Re1NN7k,Devops in ELH,/My Drive/Devops in ELH,application/vnd.google-apps.document,2024-10-24T13:32:55.608Z,pcuenco@elhaynes.org,1978,,0AHZG-qV0huDxUk9PVA
1DyuezPt-HEsV_XLLBcg117R3MSgXPsCJVB7KGjkH2mU,For Principals,/My Drive/For Principals,application/vnd.google-apps.document,2024-10-24T13:17:54.545Z,pcuenco@elhaynes.org,3524,,0AHZG-qV0huDxUk9PVA
1-Vthrrz31wElgs52ch5xTXTII_HAoJVTe52lzGDOmuA,DNS:,/My Drive/DNS:,application/vnd.google-apps.document,2024-10-23T20:14:14.072Z,pcuenco@elhaynes.org,162489,,0AHZG-qV0huDxUk9PVA
1Ix0QnTjwUA_ciUQgIbJ7W62_kvT_EXJwkNRvMuWwBo8,PSC Project short term,/My Drive/PSC Project short term,application/vnd.google-apps.spreadsheet,2024-10-23T15:23:01.185Z,pcuenco@elhaynes.org,1024,,0AHZG-qV0huDxUk9PVA
1K7XSbKs3MJavQvilAY8FQz8R6tU6m3hqphVV0wUtwl8,Security Enhancements,/My Drive/Security Enhancements,application/vnd.google-apps.document,2024-10-22T20:07:18.430Z,pcuenco@elhaynes.org,1024,,0AHZG-qV0huDxUk9PVA
1YEAprPLL8Zs4G8Uput7xHQpCZvSbFEmxPB1tlWpv5ZI,Powershell - new user AD,/My Drive/Powershell - new user AD,application/vnd.google-apps.document,2024-10-22T19:47:20.480Z,pcuenco@elhaynes.org,1024,,0AHZG-qV0huDxUk9PVA
1Yh1G_RTxs8Q3Lxey2JHJom4LTKEh4jK7FYg8JVAYD8E,[POLICY] AI Adoption,/My Drive/Policies/[POLICY] AI Adoption,application/vnd.google-apps.document,2025-07-15T18:53:32.517Z,pcuenco@elhaynes.org,3640,,1vJILRqBY8rZiuYHIb41o0ZLGLbfZ2Z1Z
1f-N7YYxh91lJ2loWBOpOOqjQdIl-G1Ct9hV72RwOABE,Untitled document,/My Drive/Policies/Untitled document,application/vnd.google-apps.document,2025-07-15T18:44:13.273Z,pcuenco@elhaynes.org,5166,,1vJILRqBY8rZiuYHIb41o0ZLGLbfZ2Z1Z
1czl3wDlZsMMwrXoKwGaiY9QKY-D4KCE2w1du0rPHsWw,[POLICY] AUP - Laptops,/My Drive/Policies/[POLICY] AUP - Laptops,application/vnd.google-apps.document,2025-06-10T20:04:20.574Z,pcuenco@elhaynes.org,6494,,1vJILRqBY8rZiuYHIb41o0ZLGLbfZ2Z1Z
1an9XAkxF9LxcO2LaGEFcMZ3tYj6myCv4m9pYxjHKxsw,Student Hotspot Request Form,/My Drive/Policies/Student Hotspot Request Form,application/vnd.google-apps.document,2025-05-02T19:31:04.722Z,pcuenco@elhaynes.org,2890,,1vJILRqBY8rZiuYHIb41o0ZLGLbfZ2Z1Z
1WCV8TiMRQOKpH63pW1hKlo9_6A8wzacvdjnyOsnuZDk,[POLICY] Student Hotspot Request and Distribution,/My Drive/Policies/[POLICY] Student Hotspot Request and Distribution,application/vnd.google-apps.document,2025-05-02T19:27:16.897Z,pcuenco@elhaynes.org,3370,,1vJILRqBY8rZiuYHIb41o0ZLGLbfZ2Z1Z
1z9NUBPLBmWqLxynVLrQ-aAQoXcs-EHixYKF4YXwbQGU,Work From Home Policy,/My Drive/Policies/Work From Home Policy,application/vnd.google-apps.document,2024-12-05T20:10:53.384Z,pcuenco@elhaynes.org,3802,,1vJILRqBY8rZiuYHIb41o0ZLGLbfZ2Z1Z
1eVpMyqsmmXcKoFleC1qNXMyh1zm0oOfj963dSfRdZtY,IT Incident Management Plan,/My Drive/Policies/IT Incident Management Plan,application/vnd.google-apps.document,2024-11-08T15:48:02.659Z,pcuenco@elhaynes.org,9710,,1vJILRqBY8rZiuYHIb41o0ZLGLbfZ2Z1Z
1LQvYmiWiKUB-JMA-JhdEB59u7nOED7en2K_Rlr-aKpo,Untitled document,/My Drive/Policies/Untitled document,application/vnd.google-apps.document,2024-10-30T19:51:35.464Z,pcuenco@elhaynes.org,1024,,1vJILRqBY8rZiuYHIb41o0ZLGLbfZ2Z1Z
11q4_7wXKvGfBCn4lrha1iT_vLVn_rvDPgh-t-PXj_dM,[POLICY] Antivirus Software for Laptops,/My Drive/Policies/[POLICY] Antivirus Software for Laptops,application/vnd.google-apps.document,2024-10-29T20:27:01.494Z,pcuenco@elhaynes.org,5050,,1vJILRqBY8rZiuYHIb41o0ZLGLbfZ2Z1Z
1gCfxSixaFSVEdGxvCHwNAb0IhgVZ1hBr5MzkS9JT4L8,[POLICY] Laptop Encryption Using BitLocker,/My Drive/Policies/[POLICY] Laptop Encryption Using BitLocker,application/vnd.google-apps.document,2024-10-29T20:20:44.563Z,pcuenco@elhaynes.org,4929,,1vJILRqBY8rZiuYHIb41o0ZLGLbfZ2Z1Z
1bDcFKx_sTyTbeWX06aH78xCCht2G1Vl4Q2RgS33F_GQ,[POLICY] Screensaver and Device Lock,/My Drive/Policies/[POLICY] Screensaver and Device Lock,application/vnd.google-apps.document,2024-10-29T20:04:41.915Z,pcuenco@elhaynes.org,4707,,1vJILRqBY8rZiuYHIb41o0ZLGLbfZ2Z1Z
1RZ6OPXKNMeUSsAVENgawgvpqRFi0BOIi,Standup,/My Drive/Meeting Notes/Standup,application/vnd.google-apps.folder,2025-02-11T14:36:14.539Z,pcuenco@elhaynes.org,,,1OxYCSRlYpc6lVT6bV5WhNHpbc1ljaZRD
1nlKQPaYCthr70gNHewexQP5QK-1FzVbd,DNS,/My Drive/Meeting Notes/DNS,application/vnd.google-apps.folder,2024-12-10T17:18:00.168Z,pcuenco@elhaynes.org,,,1OxYCSRlYpc6lVT6bV5WhNHpbc1ljaZRD
1_064sO4ZTVHS5Rfxw2ChnXVr_rV2nKATQKJLxkYlnC4,Untitled document,/My Drive/Meeting Notes/Untitled document,application/vnd.google-apps.document,2024-11-12T20:21:36.604Z,pcuenco@elhaynes.org,1024,,1OxYCSRlYpc6lVT6bV5WhNHpbc1ljaZRD
15wzGjoccwjA9BBBNiT74jzxI8wDL1rVf,All Staff,/My Drive/Meeting Notes/All Staff,application/vnd.google-apps.folder,2024-11-12T18:48:13.804Z,pcuenco@elhaynes.org,,,1OxYCSRlYpc6lVT6bV5WhNHpbc1ljaZRD
1MqYffYzjcUhsgig87bE_JXKV8JfrvBAw,Dani 1-1,/My Drive/Meeting Notes/Dani 1-1,application/vnd.google-apps.folder,2024-11-08T15:28:51.414Z,pcuenco@elhaynes.org,,,1OxYCSRlYpc6lVT6bV5WhNHpbc1ljaZRD
1xFdK0pZ4vj2oALLUqNaHmbGJZT62DlOW,Jose 1-1,/My Drive/Meeting Notes/Jose 1-1,application/vnd.google-apps.folder,2024-11-08T15:28:39.987Z,pcuenco@elhaynes.org,,,1OxYCSRlYpc6lVT6bV5WhNHpbc1ljaZRD
1bBvwWu3PxCWjU2sl9xOLQlgwAYB20ltp,Michael 1-1,/My Drive/Meeting Notes/Michael 1-1,application/vnd.google-apps.folder,2024-11-08T15:27:55.204Z,pcuenco@elhaynes.org,,,1OxYCSRlYpc6lVT6bV5WhNHpbc1ljaZRD
1tKeC4VctwJ9f3kqpGjI4sWI9hu8v0LFC,Ryan 1-1,/My Drive/Meeting Notes/Ryan 1-1,application/vnd.google-apps.folder,2024-11-08T15:26:30.903Z,pcuenco@elhaynes.org,,,1OxYCSRlYpc6lVT6bV5WhNHpbc1ljaZRD
1yNe409IinPx4dbZ-TIWTfEYmENQbg34l,Pankaj 1-1,/My Drive/Meeting Notes/Pankaj 1-1,application/vnd.google-apps.folder,2024-11-08T15:25:35.876Z,pcuenco@elhaynes.org,,,1OxYCSRlYpc6lVT6bV5WhNHpbc1ljaZRD
1ltSmQSaeMzvMg5VbddbLsZ1npKC5tjaEYzT1AhG1QyY,[PANKAJ] 09-19-2025,/My Drive/Meeting Notes/Pankaj 1-1/[PANKAJ] 09-19-2025,application/vnd.google-apps.document,2025-09-19T12:28:18.097Z,pcuenco@elhaynes.org,3250,,1yNe409IinPx4dbZ-TIWTfEYmENQbg34l
1Y31zNMMsEREZIe1zEga-fmlyuP73G_g05RafbKUxPFk,[PANKAJ] 09-12-2025,/My Drive/Meeting Notes/Pankaj 1-1/[PANKAJ] 09-12-2025,application/vnd.google-apps.document,2025-09-12T14:16:45.216Z,pcuenco@elhaynes.org,2994,,1yNe409IinPx4dbZ-TIWTfEYmENQbg34l
1NEYmL5rUbUdUqK2-9CwbHedT-ZvqR4VTbW5V13RyVRI,[PANKAJ] 09-05-2025,/My Drive/Meeting Notes/Pankaj 1-1/[PANKAJ] 09-05-2025,application/vnd.google-apps.document,2025-09-05T14:01:34.821Z,pcuenco@elhaynes.org,2864,,1yNe409IinPx4dbZ-TIWTfEYmENQbg34l
1K5Z1b9sKAz6bQMFsFAqH1bW6DGJf9iLd_TzwFtKtU8g,[PANKAJ] 08-29-2025,/My Drive/Meeting Notes/Pankaj 1-1/[PANKAJ] 08-29-2025,application/vnd.google-apps.document,2025-08-29T13:17:39.082Z,pcuenco@elhaynes.org,2836,,1yNe409IinPx4dbZ-TIWTfEYmENQbg34l
1cTKEvoLKA0keE9NzVIQ1GAx9gv5L2G-FGImw9OehxtY,[PANKAJ] 08-22-2025,/My Drive/Meeting Notes/Pankaj 1-1/[PANKAJ] 08-22-2025,application/vnd.google-apps.document,2025-08-22T13:58:32.160Z,pcuenco@elhaynes.org,2955,,1yNe409IinPx4dbZ-TIWTfEYmENQbg34l
1kRilDaqsXzKeknv0oma5HtdU36PV3Pq7hXSpsuBsWF0,[PANKAJ] 08-08-2025,/My Drive/Meeting Notes/Pankaj 1-1/[PANKAJ] 08-08-2025,application/vnd.google-apps.document,2025-08-08T14:17:39.373Z,pcuenco@elhaynes.org,3564,,1yNe409IinPx4dbZ-TIWTfEYmENQbg34l
1OaEPjcmHa94m3gLP8Mv2-IcjxglR05pYZAujA9NXdFQ,[PANKAJ] 07-18-2025,/My Drive/Meeting Notes/Pankaj 1-1/[PANKAJ] 07-18-2025,application/vnd.google-apps.document,2025-07-18T14:09:28.332Z,pcuenco@elhaynes.org,3388,,1yNe409IinPx4dbZ-TIWTfEYmENQbg34l
1vE3bU8UgAJYeqtUhQO21q4H4vSyOQ3FWmaEKJyXVxkM,[PANKAJ] 07-11-2025,/My Drive/Meeting Notes/Pankaj 1-1/[PANKAJ] 07-11-2025,application/vnd.google-apps.document,2025-07-11T14:08:20.230Z,pcuenco@elhaynes.org,3079,,1yNe409IinPx4dbZ-TIWTfEYmENQbg34l
1hzQ2MjaZ9txFjysr8boxH0teDCt6DVvz1lCgQgUWPoE,[PANKAJ] 06-27-2025,/My Drive/Meeting Notes/Pankaj 1-1/[PANKAJ] 06-27-2025,application/vnd.google-apps.document,2025-06-27T15:30:29.121Z,pcuenco@elhaynes.org,3670,,1yNe409IinPx4dbZ-TIWTfEYmENQbg34l
1AT8Tcw4c8I8hOwebmVlBrHAJKepd0QIx0Q1Y_mTPYME,[PANKAJ] 06-06-2025,/My Drive/Meeting Notes/Pankaj 1-1/[PANKAJ] 06-06-2025,application/vnd.google-apps.document,2025-06-06T14:18:37.294Z,pcuenco@elhaynes.org,3784,,1yNe409IinPx4dbZ-TIWTfEYmENQbg34l
1urFy7nI2HVy5zzHEAuJfIUpcap_7VzeKAtsDQJ9x5Ww,[PANKAJ] 05-30-2025,/My Drive/Meeting Notes/Pankaj 1-1/[PANKAJ] 05-30-2025,application/vnd.google-apps.document,2025-05-30T18:19:38.341Z,pcuenco@elhaynes.org,3372,,1yNe409IinPx4dbZ-TIWTfEYmENQbg34l
1_7lcucRnOEzEPnVe-2RSNH7Yz4PxGR_I9TwPkczQzHE,[PANKAJ] 05-23-2025,/My Drive/Meeting Notes/Pankaj 1-1/[PANKAJ] 05-23-2025,application/vnd.google-apps.document,2025-05-22T20:01:44.090Z,pcuenco@elhaynes.org,3411,,1yNe409IinPx4dbZ-TIWTfEYmENQbg34l
1rKWaR1z8EIU0FW6_QEvwM7GmUzB-8kUi59QIbTLqWT8,[PANKAJ] 05-16-2025,/My Drive/Meeting Notes/Pankaj 1-1/[PANKAJ] 05-16-2025,application/vnd.google-apps.document,2025-05-15T13:38:17.242Z,pcuenco@elhaynes.org,3666,,1yNe409IinPx4dbZ-TIWTfEYmENQbg34l
1O8KFrLzbt8qodq5FUfI5UXU_3oBMpv_xcjVf5BTRYNk,[PANKAJ] 05-09-2025,/My Drive/Meeting Notes/Pankaj 1-1/[PANKAJ] 05-09-2025,application/vnd.google-apps.document,2025-05-09T13:53:48.339Z,pcuenco@elhaynes.org,3409,,1yNe409IinPx4dbZ-TIWTfEYmENQbg34l
1tjLxLo0KHMthcHm_txZ9G8CxNQH9ibIpfqTheyrp3qY,[PANKAJ] 03-28-2025,/My Drive/Meeting Notes/Pankaj 1-1/[PANKAJ] 03-28-2025,application/vnd.google-apps.document,2025-05-09T13:25:10.888Z,pcuenco@elhaynes.org,2131,,1yNe409IinPx4dbZ-TIWTfEYmENQbg34l
1_ItzDSkOo6r8pQRmr4pKJNM49Nt0XvtzlGbH4NQ0S_c,[PANKAJ] 04-04-2025,/My Drive/Meeting Notes/Pankaj 1-1/[PANKAJ] 04-04-2025,application/vnd.google-apps.document,2025-05-09T13:25:02.306Z,pcuenco@elhaynes.org,3750,,1yNe409IinPx4dbZ-TIWTfEYmENQbg34l
18fifyzu7xvQkQsDDTswfDLkjzyfn07kJisAAAU828A0,[PANKAJ] 04-11-2025,/My Drive/Meeting Notes/Pankaj 1-1/[PANKAJ] 04-11-2025,application/vnd.google-apps.document,2025-05-09T13:24:53.836Z,pcuenco@elhaynes.org,3182,,1yNe409IinPx4dbZ-TIWTfEYmENQbg34l
1iact-Hx6fGJCkZtdbrPOIPxeO11e49g_apZdiFX3kWc,[PANKAJ] 04-25-2025,/My Drive/Meeting Notes/Pankaj 1-1/[PANKAJ] 04-25-2025,application/vnd.google-apps.document,2025-05-09T13:24:36.521Z,pcuenco@elhaynes.org,3327,,1yNe409IinPx4dbZ-TIWTfEYmENQbg34l
1uXTp570GVl1AQ-OdX_bInn1iArRfFdAVSSBwnh5zwS0,[PANKAJ] 05-02-2025,/My Drive/Meeting Notes/Pankaj 1-1/[PANKAJ] 05-02-2025,application/vnd.google-apps.document,2025-05-09T13:24:26.663Z,pcuenco@elhaynes.org,3061,,1yNe409IinPx4dbZ-TIWTfEYmENQbg34l
11wAqY3N3h-Q5ACVtumyCFsVQppLSPX8I8gZXY_FSQ9s,03-07-2025,/My Drive/Meeting Notes/Pankaj 1-1/03-07-2025,application/vnd.google-apps.document,2025-03-07T18:38:52.634Z,pcuenco@elhaynes.org,2188,,1yNe409IinPx4dbZ-TIWTfEYmENQbg34l
1sVf_d6Xg0sVlcoqP88OghltMRf_MCqeHzJMxcbicoR4,02-28-2025,/My Drive/Meeting Notes/Pankaj 1-1/02-28-2025,application/vnd.google-apps.document,2025-02-28T15:37:01.452Z,pcuenco@elhaynes.org,2308,,1yNe409IinPx4dbZ-TIWTfEYmENQbg34l
19PgtyL00XUHHytzoHKna2d-0lbzJqzs7KdEnCAOLyzI,01-07-2025,/My Drive/Meeting Notes/Pankaj 1-1/01-07-2025,application/vnd.google-apps.document,2025-02-06T14:50:06.916Z,pcuenco@elhaynes.org,2308,,1yNe409IinPx4dbZ-TIWTfEYmENQbg34l
1L1g3lsLW97okN96dVAOB_G4Wic5Gpw9j2wkynIurN0M,01-24-2025,/My Drive/Meeting Notes/Pankaj 1-1/01-24-2025,application/vnd.google-apps.document,2025-01-24T15:04:02.180Z,pcuenco@elhaynes.org,2758,,1yNe409IinPx4dbZ-TIWTfEYmENQbg34l
1YxrkZ7MEYNotiWRxHRo7l-t-2jr3tcidNYiyIPpoEKY,01-17-2025,/My Drive/Meeting Notes/Pankaj 1-1/01-17-2025,application/vnd.google-apps.document,2025-01-17T15:17:38.322Z,pcuenco@elhaynes.org,2348,,1yNe409IinPx4dbZ-TIWTfEYmENQbg34l
1vvyOMjkIO_mrtIz7c3rAWvpV7QK9prLruRbmZMMR44s,01-03-2025,/My Drive/Meeting Notes/Pankaj 1-1/01-03-2025,application/vnd.google-apps.document,2025-01-03T15:20:48.544Z,pcuenco@elhaynes.org,1481,,1yNe409IinPx4dbZ-TIWTfEYmENQbg34l
1lU4-h51qsbb9Pd8glnlpBcowq72nqgf5PwOU-mPJ6do,12-20-2024,/My Drive/Meeting Notes/Pankaj 1-1/12-20-2024,application/vnd.google-apps.document,2024-12-20T15:09:45.144Z,pcuenco@elhaynes.org,1828,,1yNe409IinPx4dbZ-TIWTfEYmENQbg34l
1wmIQ5VmNsJkXuHLVEOpzRhSiwmsVNfSvqcGmuPFEe4E,12-6-2024,/My Drive/Meeting Notes/Pankaj 1-1/12-6-2024,application/vnd.google-apps.document,2024-12-06T14:51:53.794Z,pcuenco@elhaynes.org,2113,,1yNe409IinPx4dbZ-TIWTfEYmENQbg34l
11ExEA95pN2FqOUzmCLyEmREevQvmeHKLJjufd0NQeSE,02-10-2025,/My Drive/Meeting Notes/Ryan 1-1/02-10-2025,application/vnd.google-apps.document,2025-02-10T20:36:36.903Z,pcuenco@elhaynes.org,1806,,1tKeC4VctwJ9f3kqpGjI4sWI9hu8v0LFC
1z7vuldQ-oKnHt3oR4oNRrHg3D4No5_7F6j-UJRSghJc,12-02-2024,/My Drive/Meeting Notes/Ryan 1-1/12-02-2024,application/vnd.google-apps.document,2024-12-02T20:35:24.281Z,pcuenco@elhaynes.org,2154,,1tKeC4VctwJ9f3kqpGjI4sWI9hu8v0LFC
1ldag24oTajlztcgb4iCYzmJpapGWpu-OWLFeNmLVipA,11-18-2024,/My Drive/Meeting Notes/Ryan 1-1/11-18-2024,application/vnd.google-apps.document,2024-11-18T20:55:16.868Z,pcuenco@elhaynes.org,2152,,1tKeC4VctwJ9f3kqpGjI4sWI9hu8v0LFC
10Vzk6WM40eIRK4ynnV6CB02Ppfwvj9rVMq8gRLnItII,[MC] 07-02-2025,/My Drive/Meeting Notes/Michael 1-1/[MC] 07-02-2025,application/vnd.google-apps.document,2025-07-02T14:54:33.434Z,pcuenco@elhaynes.org,1799,,1bBvwWu3PxCWjU2sl9xOLQlgwAYB20ltp
1RXKli772aqp_LiZOyI7B78c3hflqaohODKjmJrXknpg,[MC] 05-23-2025,/My Drive/Meeting Notes/Michael 1-1/[MC] 05-23-2025,application/vnd.google-apps.document,2025-05-23T15:39:30.880Z,pcuenco@elhaynes.org,1875,,1bBvwWu3PxCWjU2sl9xOLQlgwAYB20ltp
1MP_zy6ZMZzbxraNPb5iosE6Fzvf9T4A2oNZ20Dj9kOU,[MC] 05-16-2025,/My Drive/Meeting Notes/Michael 1-1/[MC] 05-16-2025,application/vnd.google-apps.document,2025-05-16T15:39:48.497Z,pcuenco@elhaynes.org,1658,,1bBvwWu3PxCWjU2sl9xOLQlgwAYB20ltp
18Muh1n6VYypkW2rfNAMLFIRYvh1zVJDPfzHGXxG1mpk,[MC] 05-09-2025,/My Drive/Meeting Notes/Michael 1-1/[MC] 05-09-2025,application/vnd.google-apps.document,2025-05-09T15:34:16.830Z,pcuenco@elhaynes.org,2204,,1bBvwWu3PxCWjU2sl9xOLQlgwAYB20ltp
1uvHUIO-vPNRtv2OuKJI0CE9BZK4bhp4uJjbuBsHNt60,[MC] 04-04-2025,/My Drive/Meeting Notes/Michael 1-1/[MC] 04-04-2025,application/vnd.google-apps.document,2025-05-09T15:27:29.218Z,pcuenco@elhaynes.org,1506,,1bBvwWu3PxCWjU2sl9xOLQlgwAYB20ltp
1JK2o7s8eN5qNhl4LC2-gXMyznOtCoxkCDrb8cSmJAzk,[MC] 04-11-2025,/My Drive/Meeting Notes/Michael 1-1/[MC] 04-11-2025,application/vnd.google-apps.document,2025-05-09T15:27:22.374Z,pcuenco@elhaynes.org,1797,,1bBvwWu3PxCWjU2sl9xOLQlgwAYB20ltp
1iry8HtBof5v7unIytUuKvkGa91oQNXFADFUU-ueo0ck,[MC] 04-25-2025,/My Drive/Meeting Notes/Michael 1-1/[MC] 04-25-2025,application/vnd.google-apps.document,2025-05-09T15:27:15.911Z,pcuenco@elhaynes.org,1864,,1bBvwWu3PxCWjU2sl9xOLQlgwAYB20ltp
1ZE-LxapMZ-pARqbwVAwwm_AYoHuT2qnF2eHsFZzsUW0,03-28-2025,/My Drive/Meeting Notes/Michael 1-1/03-28-2025,application/vnd.google-apps.document,2025-04-04T15:04:45.433Z,pcuenco@elhaynes.org,1755,,1bBvwWu3PxCWjU2sl9xOLQlgwAYB20ltp
1eoXGEGFwRzd_fskyAShH8WKFQbsLPBUl0JhtUfmD11c,03-21-2025,/My Drive/Meeting Notes/Michael 1-1/03-21-2025,application/vnd.google-apps.document,2025-03-21T15:25:09.615Z,pcuenco@elhaynes.org,1650,,1bBvwWu3PxCWjU2sl9xOLQlgwAYB20ltp
1h4q1wu0lpKu1R4_T9VT2kxr01neEMHdYv5P5CVymgfk,03-14-2025,/My Drive/Meeting Notes/Michael 1-1/03-14-2025,application/vnd.google-apps.document,2025-03-14T17:07:23.502Z,pcuenco@elhaynes.org,2100,,1bBvwWu3PxCWjU2sl9xOLQlgwAYB20ltp
1tXXzZnanNoNHWEdrTTjHEYWms67t1kUcRgafU_4hZU0,03-10-2025,/My Drive/Meeting Notes/Michael 1-1/03-10-2025,application/vnd.google-apps.document,2025-03-10T16:16:43.111Z,pcuenco@elhaynes.org,2070,,1bBvwWu3PxCWjU2sl9xOLQlgwAYB20ltp
1TaCZmfK6RDPkjKdUELcrXGEnRrlel7RNN-vcz_29v4k,02-28-2025,/My Drive/Meeting Notes/Michael 1-1/02-28-2025,application/vnd.google-apps.document,2025-02-28T16:55:56.296Z,pcuenco@elhaynes.org,1961,,1bBvwWu3PxCWjU2sl9xOLQlgwAYB20ltp
1oKMLZYZWcKxOUo3ArBxYpKkR0hAczItDpL0tUKGnLEw,02-21-2025,/My Drive/Meeting Notes/Michael 1-1/02-21-2025,application/vnd.google-apps.document,2025-02-21T16:50:26.641Z,pcuenco@elhaynes.org,2110,,1bBvwWu3PxCWjU2sl9xOLQlgwAYB20ltp
1SxvOFKaxIO0fwDzr_4wg2DsHhZX9KosfPrgVFUYmxNI,1-31-2025,/My Drive/Meeting Notes/Michael 1-1/1-31-2025,application/vnd.google-apps.document,2025-01-31T18:33:06.474Z,pcuenco@elhaynes.org,1763,,1bBvwWu3PxCWjU2sl9xOLQlgwAYB20ltp
1Wl-UNTd5U0Wa6h22NchtzM5Jc2t1ajgwb9cTlhx64Iw,1-24-2025,/My Drive/Meeting Notes/Michael 1-1/1-24-2025,application/vnd.google-apps.document,2025-01-24T16:40:38.055Z,pcuenco@elhaynes.org,1761,,1bBvwWu3PxCWjU2sl9xOLQlgwAYB20ltp
1yv9V7i6qKAyvbEa-Pel2TsaVhCIQRDQUMsHDmZuiKzA,1-17-2025,/My Drive/Meeting Notes/Michael 1-1/1-17-2025,application/vnd.google-apps.document,2025-01-17T18:19:46.709Z,pcuenco@elhaynes.org,2342,,1bBvwWu3PxCWjU2sl9xOLQlgwAYB20ltp
12FZu3Cqgt8utCTfToKB3c0fxSPd5NO3Tmy9B0FuVILs,12-20-2024,/My Drive/Meeting Notes/Michael 1-1/12-20-2024,application/vnd.google-apps.document,2024-12-20T17:48:26.412Z,pcuenco@elhaynes.org,2473,,1bBvwWu3PxCWjU2sl9xOLQlgwAYB20ltp
18i9bUIVOQLZb5ZJoBaN90gWIgstpDpCoqg5Fn4aXDK0,12-13-2024,/My Drive/Meeting Notes/Michael 1-1/12-13-2024,application/vnd.google-apps.document,2024-12-13T15:25:01.510Z,pcuenco@elhaynes.org,2249,,1bBvwWu3PxCWjU2sl9xOLQlgwAYB20ltp
1FFB5VhSvDb0WSkIlFn5rEoRB6H2SqkYMAt5WKvyzG9o,12-6-2024,/My Drive/Meeting Notes/Michael 1-1/12-6-2024,application/vnd.google-apps.document,2024-12-06T15:39:13.350Z,pcuenco@elhaynes.org,2173,,1bBvwWu3PxCWjU2sl9xOLQlgwAYB20ltp
1zegT7dp4fy02mYOkT434-lCalKXGFXxIOotrHXXTJCs,11-22-2024,/My Drive/Meeting Notes/Michael 1-1/11-22-2024,application/vnd.google-apps.document,2024-11-22T15:50:36.713Z,pcuenco@elhaynes.org,2109,,1bBvwWu3PxCWjU2sl9xOLQlgwAYB20ltp
1EifiM8Up181Xwo8QoLKWsTCOy6kukbbAEP7YpOJeMm4,11-15-2024,/My Drive/Meeting Notes/Michael 1-1/11-15-2024,application/vnd.google-apps.document,2024-11-15T16:04:38.715Z,pcuenco@elhaynes.org,2090,,1bBvwWu3PxCWjU2sl9xOLQlgwAYB20ltp
19-wDLO77BWVB-6hunC1sA01Kc1QcQ0JfTQAmRKoYjtE,[JM] 06-05-2025,/My Drive/Meeting Notes/Jose 1-1/[JM] 06-05-2025,application/vnd.google-apps.document,2025-06-27T12:40:08.095Z,pcuenco@elhaynes.org,2032,,1xFdK0pZ4vj2oALLUqNaHmbGJZT62DlOW
18ARkEWOp74q__aj_o6n0aeP9Tt7pzlJD44UsG4rLI84,[JM] 05-22-2025 - No meeting,/My Drive/Meeting Notes/Jose 1-1/[JM] 05-22-2025 - No meeting,application/vnd.google-apps.document,2025-05-22T19:22:22.431Z,pcuenco@elhaynes.org,2032,,1xFdK0pZ4vj2oALLUqNaHmbGJZT62DlOW
1Cwqad52_Gemw7B66DgmfmlzUhQZzEAMRwz9XaTpVdkw,[JM] 05-15-2025,/My Drive/Meeting Notes/Jose 1-1/[JM] 05-15-2025,application/vnd.google-apps.document,2025-05-15T19:58:35.389Z,pcuenco@elhaynes.org,1852,,1xFdK0pZ4vj2oALLUqNaHmbGJZT62DlOW
1sVuCn_S7vyG0xCyqBPN4nJ2vGILRdR30nlvkID1GoBM,[JM] 05-08-2025,/My Drive/Meeting Notes/Jose 1-1/[JM] 05-08-2025,application/vnd.google-apps.document,2025-05-15T18:34:08.348Z,pcuenco@elhaynes.org,2220,,1xFdK0pZ4vj2oALLUqNaHmbGJZT62DlOW
1ckzCgXJs9I4Jru8q_KnTPYOGim5tTtpQiHdDsfMhfGE,04-24-2025,/My Drive/Meeting Notes/Jose 1-1/04-24-2025,application/vnd.google-apps.document,2025-04-24T19:58:33.827Z,pcuenco@elhaynes.org,2014,,1xFdK0pZ4vj2oALLUqNaHmbGJZT62DlOW
1-AFiokOgDYtUYJLDLr9VTXlGVwKa121MQqvY9coCpvU,04-10-2025 [No Meeting],/My Drive/Meeting Notes/Jose 1-1/04-10-2025 [No Meeting],application/vnd.google-apps.document,2025-04-10T19:57:18.145Z,pcuenco@elhaynes.org,1256,,1xFdK0pZ4vj2oALLUqNaHmbGJZT62DlOW
1wQJf2DHxYbwuLVJ1QUh50Zrd5USfCPr2YbJ7fY3bFZo,04-03-2025 [No Meeting],/My Drive/Meeting Notes/Jose 1-1/04-03-2025 [No Meeting],application/vnd.google-apps.document,2025-04-03T19:54:40.397Z,pcuenco@elhaynes.org,1576,,1xFdK0pZ4vj2oALLUqNaHmbGJZT62DlOW
1-pAJK8fln0IYXrWYMNEPtCSN1oYQfHOcNc8P0BuVRm0,03-27-2025,/My Drive/Meeting Notes/Jose 1-1/03-27-2025,application/vnd.google-apps.document,2025-03-27T19:38:25.766Z,pcuenco@elhaynes.org,1403,,1xFdK0pZ4vj2oALLUqNaHmbGJZT62DlOW
11SHGIY5Jdab-YfQ-PM9tEMbbNQROuVgSpSFohtoG7yg,[No Show] 02-27-2025,/My Drive/Meeting Notes/Jose 1-1/[No Show] 02-27-2025,application/vnd.google-apps.document,2025-02-28T13:21:31.514Z,pcuenco@elhaynes.org,1603,,1xFdK0pZ4vj2oALLUqNaHmbGJZT62DlOW
1MmIr9nt3KbHSnKdeNNRYH89ziTW3hcyvn89Eji_Hg0A,02-20-2025,/My Drive/Meeting Notes/Jose 1-1/02-20-2025,application/vnd.google-apps.document,2025-02-20T21:05:37.593Z,pcuenco@elhaynes.org,1402,,1xFdK0pZ4vj2oALLUqNaHmbGJZT62DlOW
15qCGDgrGCjqehkUvcM0oU-MVb9bAmhnZFw5bboligGo,02-13-2025,/My Drive/Meeting Notes/Jose 1-1/02-13-2025,application/vnd.google-apps.document,2025-02-13T21:02:29.425Z,pcuenco@elhaynes.org,1024,,1xFdK0pZ4vj2oALLUqNaHmbGJZT62DlOW
1mSExiJu1vfHfVM48RUwvwsJf7KhlbV6dfbuOuI_qQ_c,01-31-2025,/My Drive/Meeting Notes/Jose 1-1/01-31-2025,application/vnd.google-apps.document,2025-01-31T16:30:32.291Z,pcuenco@elhaynes.org,1743,,1xFdK0pZ4vj2oALLUqNaHmbGJZT62DlOW
1JEO4L1GHVojVAlMnBFavtV6SkPK0ixEEz67-vhVCWZA,01-16-2025,/My Drive/Meeting Notes/Jose 1-1/01-16-2025,application/vnd.google-apps.document,2025-01-31T16:01:52.612Z,pcuenco@elhaynes.org,2342,,1xFdK0pZ4vj2oALLUqNaHmbGJZT62DlOW
1cdpQdMYkU9tWcGm0wXfg7W5_LY7x5FeStn26pwbvEHk,01-10-2025,/My Drive/Meeting Notes/Jose 1-1/01-10-2025,application/vnd.google-apps.document,2025-01-10T20:04:42.090Z,pcuenco@elhaynes.org,2065,,1xFdK0pZ4vj2oALLUqNaHmbGJZT62DlOW
12AZPI0VoPVLRWJdesFSGAPlj_-LbHDe9HiUBgle0krk,12-19-2024,/My Drive/Meeting Notes/Jose 1-1/12-19-2024,application/vnd.google-apps.document,2024-12-19T21:25:03.523Z,pcuenco@elhaynes.org,1847,,1xFdK0pZ4vj2oALLUqNaHmbGJZT62DlOW
1MR6fPe7AOJwS-GqyrAOy9jFgUy1SMWs1lxyR3BsjW_M,12-5-2024,/My Drive/Meeting Notes/Jose 1-1/12-5-2024,application/vnd.google-apps.document,2024-12-05T20:57:03.246Z,pcuenco@elhaynes.org,1024,,1xFdK0pZ4vj2oALLUqNaHmbGJZT62DlOW
1Fh7hp2NG4VY6A-SjS00K6k1OQ8eckZ-Uc2iME2qnyC4,01-28-25,/My Drive/Meeting Notes/Dani 1-1/01-28-25,application/vnd.google-apps.document,2025-01-28T14:19:38.044Z,pcuenco@elhaynes.org,2023,,1MqYffYzjcUhsgig87bE_JXKV8JfrvBAw
1rj5OdHnvMZPdeOtYWibNrbOD3EBFxbJ0kLupy6M6tsQ,01-16-25,/My Drive/Meeting Notes/Dani 1-1/01-16-25,application/vnd.google-apps.document,2025-01-16T14:37:29.923Z,pcuenco@elhaynes.org,2531,,1MqYffYzjcUhsgig87bE_JXKV8JfrvBAw
1ZDtC0e4HAHF9arbxiEIM3NKguEEAhPqf86i6g-hBFCY,12-17-24,/My Drive/Meeting Notes/Dani 1-1/12-17-24,application/vnd.google-apps.document,2024-12-19T21:07:19.143Z,pcuenco@elhaynes.org,2417,,1MqYffYzjcUhsgig87bE_JXKV8JfrvBAw
1nv10wEzqge1Y4y1NQBQWBErR8ZYk3wRwbCp7p0BGeQs,12-10-24,/My Drive/Meeting Notes/Dani 1-1/12-10-24,application/vnd.google-apps.document,2024-12-10T14:06:55.874Z,pcuenco@elhaynes.org,2366,,1MqYffYzjcUhsgig87bE_JXKV8JfrvBAw
1447Hj6m42YhR_eGZ6keL3kTCtjRqsxxM5odynsHBkYA,12-3-24,/My Drive/Meeting Notes/Dani 1-1/12-3-24,application/vnd.google-apps.document,2024-12-03T15:05:01.944Z,pcuenco@elhaynes.org,2307,,1MqYffYzjcUhsgig87bE_JXKV8JfrvBAw
1Czq3I4lN6hCzhWBn0J3_w7yCoWPH7Tx6_kWyp-NAMMc,11-19-2024,/My Drive/Meeting Notes/Dani 1-1/11-19-2024,application/vnd.google-apps.document,2024-11-19T14:37:11.808Z,pcuenco@elhaynes.org,2151,,1MqYffYzjcUhsgig87bE_JXKV8JfrvBAw
1bMWlEJE3JY5yXtjpCntuekDxSpLtOGAWEBqhDX10Dzc,11-12-2024 Meeting,/My Drive/Meeting Notes/Dani 1-1/11-12-2024 Meeting,application/vnd.google-apps.document,2024-11-12T15:19:24.760Z,pcuenco@elhaynes.org,1024,,1MqYffYzjcUhsgig87bE_JXKV8JfrvBAw
17dwvsC7mas9ay0bTO7nd4vDe1vcnCg4yr4JsAARaEz8,[All Staff] Discussion topics,/My Drive/Meeting Notes/All Staff/[All Staff] Discussion topics,application/vnd.google-apps.document,2024-11-12T19:40:13.175Z,pcuenco@elhaynes.org,1024,,15wzGjoccwjA9BBBNiT74jzxI8wDL1rVf
1qWVYF10svLOBpiNnC1GU3rGGogMDeUFwXXP0hb8UPz8,Untitled document,/My Drive/Meeting Notes/DNS/Untitled document,application/vnd.google-apps.document,2025-02-25T18:53:45.009Z,pcuenco@elhaynes.org,1024,,1nlKQPaYCthr70gNHewexQP5QK-1FzVbd
1Ti-_NCvVQKFGSdSVy8PLlvdCfvYlmyW0nB1b4Ma345s,12-10-2024 DNS Tech Discussion,/My Drive/Meeting Notes/DNS/12-10-2024 DNS Tech Discussion,application/vnd.google-apps.document,2024-12-10T19:19:53.284Z,pcuenco@elhaynes.org,2139,,1nlKQPaYCthr70gNHewexQP5QK-1FzVbd
1Bw-cJhnTNUuyP_CZ8vOf0bk0yBtrIyCL3xA9JnZYvEw,11-19-2024 DNS Tech Discussion,/My Drive/Meeting Notes/DNS/11-19-2024 DNS Tech Discussion,application/vnd.google-apps.document,2024-11-19T21:28:03.120Z,pcuenco@elhaynes.org,2095,,1nlKQPaYCthr70gNHewexQP5QK-1FzVbd
1L_g2UvpZ4ghBuOFHDSuqAgAQNihPufV2sumSVB31whk,[IT] 06-27-2025,/My Drive/Meeting Notes/Standup/[IT] 06-27-2025,application/vnd.google-apps.document,2025-06-27T19:18:28.077Z,pcuenco@elhaynes.org,3747,,1RZ6OPXKNMeUSsAVENgawgvpqRFi0BOIi
1-OYViXaUk2JF72E14AFvfz9QL8JwXPebp6srM6oWQ9o,[IT] 06-11-2025,/My Drive/Meeting Notes/Standup/[IT] 06-11-2025,application/vnd.google-apps.document,2025-06-11T15:18:53.811Z,pcuenco@elhaynes.org,3887,,1RZ6OPXKNMeUSsAVENgawgvpqRFi0BOIi
1xgeBouSgHsJrsPiQZUVDsXjgiCheoDrPhi37VBgdi_A,[IT] 06-04-2025,/My Drive/Meeting Notes/Standup/[IT] 06-04-2025,application/vnd.google-apps.document,2025-06-04T19:15:36.356Z,pcuenco@elhaynes.org,4204,,1RZ6OPXKNMeUSsAVENgawgvpqRFi0BOIi
1wmWgGPqG1iNbhLUOeJflQ6q8j3uTRSjsbmmotFTJfeo,[IT] 05-19-2025,/My Drive/Meeting Notes/Standup/[IT] 05-19-2025,application/vnd.google-apps.document,2025-05-19T19:07:19.818Z,pcuenco@elhaynes.org,3983,,1RZ6OPXKNMeUSsAVENgawgvpqRFi0BOIi
1sSHXZVBsoBesDuPX7ySHEVBal3qEQFqJztiPWWBr_sI,[IT] 05-16-2025,/My Drive/Meeting Notes/Standup/[IT] 05-16-2025,application/vnd.google-apps.document,2025-05-16T18:49:11.105Z,pcuenco@elhaynes.org,4014,,1RZ6OPXKNMeUSsAVENgawgvpqRFi0BOIi
18pR_a1-Cc4BgjK7WF4EUzVc-XzFdwwmMa6F6IZCwI4I,[IT] 05-14-2025,/My Drive/Meeting Notes/Standup/[IT] 05-14-2025,application/vnd.google-apps.document,2025-05-14T19:29:31.016Z,pcuenco@elhaynes.org,3494,,1RZ6OPXKNMeUSsAVENgawgvpqRFi0BOIi
1oW6c0OCW6EJw9TlteIfFtLFU6E5zYnEgJ8_DOQ3T8I0,[IT] 04-28-2025,/My Drive/Meeting Notes/Standup/[IT] 04-28-2025,application/vnd.google-apps.document,2025-05-14T18:41:21.461Z,pcuenco@elhaynes.org,4189,,1RZ6OPXKNMeUSsAVENgawgvpqRFi0BOIi
148wbazlS_iQvnpjf81vSEyJ-a67jiEU-wMmwn3iM2JE,[IT] 04-30-2025 - No show,/My Drive/Meeting Notes/Standup/[IT] 04-30-2025 - No show,application/vnd.google-apps.document,2025-05-14T18:41:14.650Z,pcuenco@elhaynes.org,4754,,1RZ6OPXKNMeUSsAVENgawgvpqRFi0BOIi
17K1oNgsVaY2qigowygZOsgeNHBhUHEts8q7vv3bo4To,[IT] 05-02-2025,/My Drive/Meeting Notes/Standup/[IT] 05-02-2025,application/vnd.google-apps.document,2025-05-14T18:41:07.181Z,pcuenco@elhaynes.org,3564,,1RZ6OPXKNMeUSsAVENgawgvpqRFi0BOIi
1rduuMNCtPMKdGlUf-KzRP2W9krvhtKBiMJPRd4X9h-A,[IT] 05-07-2025,/My Drive/Meeting Notes/Standup/[IT] 05-07-2025,application/vnd.google-apps.document,2025-05-14T18:41:00.628Z,pcuenco@elhaynes.org,3668,,1RZ6OPXKNMeUSsAVENgawgvpqRFi0BOIi
1vXp1ofiQxnzwy1veorVjS_bxq5rCJrOhwknW8NNdY00,04-25-2025,/My Drive/Meeting Notes/Standup/04-25-2025,application/vnd.google-apps.document,2025-04-25T19:06:19.900Z,pcuenco@elhaynes.org,4532,,1RZ6OPXKNMeUSsAVENgawgvpqRFi0BOIi
1lsI090qg2LkqcW299lhD4zXUXcuDOgd_ZjIymnCJ--w,04-23-2025,/My Drive/Meeting Notes/Standup/04-23-2025,application/vnd.google-apps.document,2025-04-23T18:56:57.018Z,pcuenco@elhaynes.org,4532,,1RZ6OPXKNMeUSsAVENgawgvpqRFi0BOIi
1h72O4oXGwFBbTOX9Lh3hmO4Oje_wAGqJEC0jWUxiTrI,04-21-2025,/My Drive/Meeting Notes/Standup/04-21-2025,application/vnd.google-apps.document,2025-04-21T19:06:44.325Z,pcuenco@elhaynes.org,4290,,1RZ6OPXKNMeUSsAVENgawgvpqRFi0BOIi
1do22-n5QDyzSiw-lYEOOZa8I-gonr2FF8OfUaGIHa3A,04-14-2025,/My Drive/Meeting Notes/Standup/04-14-2025,application/vnd.google-apps.document,2025-04-14T16:35:43.015Z,pcuenco@elhaynes.org,4520,,1RZ6OPXKNMeUSsAVENgawgvpqRFi0BOIi
1oD8hhhjDuvQARhbDumCAenFa9jKYvJkpwBxN1ylRD0U,04-11-2025,/My Drive/Meeting Notes/Standup/04-11-2025,application/vnd.google-apps.document,2025-04-11T19:13:46.550Z,pcuenco@elhaynes.org,4425,,1RZ6OPXKNMeUSsAVENgawgvpqRFi0BOIi
1i8YLr9GC1_Os5ZPLnL41uY9qxZUWUWp4YOXcmhr1Uc8,04-07-2025,/My Drive/Meeting Notes/Standup/04-07-2025,application/vnd.google-apps.document,2025-04-07T19:20:22.779Z,pcuenco@elhaynes.org,4232,,1RZ6OPXKNMeUSsAVENgawgvpqRFi0BOIi
1OieSvXxR7H4t2Nbw5GFihCGTxmG0UKuKndE0eB5-ODU,04-04-2025,/My Drive/Meeting Notes/Standup/04-04-2025,application/vnd.google-apps.document,2025-04-04T19:43:58.633Z,pcuenco@elhaynes.org,4564,,1RZ6OPXKNMeUSsAVENgawgvpqRFi0BOIi
1Qq8hpziXzwQXWPoXPe_i95jVqpC0NZXXOn1g3FdCNkc,04-02-2025,/My Drive/Meeting Notes/Standup/04-02-2025,application/vnd.google-apps.document,2025-04-02T19:09:03.359Z,pcuenco@elhaynes.org,4308,,1RZ6OPXKNMeUSsAVENgawgvpqRFi0BOIi
1QY1BERHqe1Tu-D-49cEFlUHwNpgxqIPYYgLqCgaCQ4g,03-31-2025,/My Drive/Meeting Notes/Standup/03-31-2025,application/vnd.google-apps.document,2025-03-31T19:12:28.556Z,pcuenco@elhaynes.org,4295,,1RZ6OPXKNMeUSsAVENgawgvpqRFi0BOIi
12jn9Nb2PH7q4iATKI3a_NtNpXpoKd9aLSF_TxmL1uG0,03-26-2025,/My Drive/Meeting Notes/Standup/03-26-2025,application/vnd.google-apps.document,2025-03-26T19:33:10.392Z,pcuenco@elhaynes.org,4465,,1RZ6OPXKNMeUSsAVENgawgvpqRFi0BOIi
1kHeIoz0kKRpFzV__YAJKod5iocrZMpPb341QwZxLUlQ,03-20-2025,/My Drive/Meeting Notes/Standup/03-20-2025,application/vnd.google-apps.document,2025-03-24T18:10:13.919Z,pcuenco@elhaynes.org,3933,,1RZ6OPXKNMeUSsAVENgawgvpqRFi0BOIi
19z4--RXohnrLGO-emzFCVij9HX6UU7mgAVTGvwvgiaw,03-14-2025,/My Drive/Meeting Notes/Standup/03-14-2025,application/vnd.google-apps.document,2025-03-14T18:57:16.432Z,pcuenco@elhaynes.org,3892,,1RZ6OPXKNMeUSsAVENgawgvpqRFi0BOIi
1HugWNB2TzfMwvpcmeKCtLAVisvIGVhwiTjj0YgaTK04,03-12-2025,/My Drive/Meeting Notes/Standup/03-12-2025,application/vnd.google-apps.document,2025-03-12T19:22:35.148Z,pcuenco@elhaynes.org,36828,,1RZ6OPXKNMeUSsAVENgawgvpqRFi0BOIi
16UxGOAG79j2fxajQvXXiKBTkT2eNNA_CZWIBvypSI6k,03-10-2025,/My Drive/Meeting Notes/Standup/03-10-2025,application/vnd.google-apps.document,2025-03-11T17:37:29.946Z,pcuenco@elhaynes.org,3288,,1RZ6OPXKNMeUSsAVENgawgvpqRFi0BOIi
1DUaetM8KhieMuxXwXqOsONx1eBrhnsq6wsI3usagouY,03-03-2025,/My Drive/Meeting Notes/Standup/03-03-2025,application/vnd.google-apps.document,2025-03-04T15:06:28.814Z,pcuenco@elhaynes.org,3132,,1RZ6OPXKNMeUSsAVENgawgvpqRFi0BOIi
1oYOHuM3oXJ4V-Eui8V9m3Yxytd26Vrww1gcMM9Sv3o4,02-28-2025,/My Drive/Meeting Notes/Standup/02-28-2025,application/vnd.google-apps.document,2025-02-28T20:05:15.359Z,pcuenco@elhaynes.org,2963,,1RZ6OPXKNMeUSsAVENgawgvpqRFi0BOIi
1fKEP4j-lYivYdrOXNEqM0X-N81HljE-qHxhDGbh6uMk,02-24-2025,/My Drive/Meeting Notes/Standup/02-24-2025,application/vnd.google-apps.document,2025-02-24T20:22:28.165Z,pcuenco@elhaynes.org,2708,,1RZ6OPXKNMeUSsAVENgawgvpqRFi0BOIi
1GTbDe0Mkap2RfE2ZkcAVMa4EjAjmv2FLmi45PPYM4JE,02-19-2025,/My Drive/Meeting Notes/Standup/02-19-2025,application/vnd.google-apps.document,2025-02-19T20:58:55.001Z,pcuenco@elhaynes.org,3161,,1RZ6OPXKNMeUSsAVENgawgvpqRFi0BOIi
1g9-aVeJtQwsuXk05P04chH4s3OfYC6r_9c73U_xsGL4,02-12-2025,/My Drive/Meeting Notes/Standup/02-12-2025,application/vnd.google-apps.document,2025-02-12T16:59:48.054Z,pcuenco@elhaynes.org,2859,,1RZ6OPXKNMeUSsAVENgawgvpqRFi0BOIi
1yNLfpD_aeFbhmguON0v0AR6bjzf04aDpJRSVT2GFYBw,02-10-2025,/My Drive/Meeting Notes/Standup/02-10-2025,application/vnd.google-apps.document,2025-02-11T14:37:21.907Z,pcuenco@elhaynes.org,2896,,1RZ6OPXKNMeUSsAVENgawgvpqRFi0BOIi
1kHnn7106kdZejZiwOeNpIeH24qkKFs7WGXFVzxoOgY0,02-03-2025,/My Drive/Meeting Notes/Standup/02-03-2025,application/vnd.google-apps.document,2025-02-03T20:58:22.206Z,pcuenco@elhaynes.org,2768,,1RZ6OPXKNMeUSsAVENgawgvpqRFi0BOIi
1SDzK7DgztgOmh8U4zb6Nkyyr2jZ4ivveDDftgcnEWyo,01-31-2025,/My Drive/Meeting Notes/Standup/01-31-2025,application/vnd.google-apps.document,2025-01-31T20:17:27.821Z,pcuenco@elhaynes.org,2502,,1RZ6OPXKNMeUSsAVENgawgvpqRFi0BOIi
1rGw5wag0gWtg1yqZ5vFj_hwB00uR30YrlIYWgBygk3g,01-24-2025,/My Drive/Meeting Notes/Standup/01-24-2025,application/vnd.google-apps.document,2025-01-24T20:27:20.966Z,pcuenco@elhaynes.org,2801,,1RZ6OPXKNMeUSsAVENgawgvpqRFi0BOIi
1gwqiOidT_KphHhio5i7SVJW9Y8kpfuWv6G_68BctN7Y,01-15-2025,/My Drive/Meeting Notes/Standup/01-15-2025,application/vnd.google-apps.document,2025-01-15T20:09:43.879Z,pcuenco@elhaynes.org,2757,,1RZ6OPXKNMeUSsAVENgawgvpqRFi0BOIi
1F5zQdqUTval4czCntiQzucRbjXBcvxk_iZuHPk0oZS4,01-13-2025,/My Drive/Meeting Notes/Standup/01-13-2025,application/vnd.google-apps.document,2025-01-13T20:05:24.785Z,pcuenco@elhaynes.org,3098,,1RZ6OPXKNMeUSsAVENgawgvpqRFi0BOIi
1C7a4QCnfOkhu1bFoHdgrGOg8BlHHuFNQGI0-jCBVyhk,01-08-2025,/My Drive/Meeting Notes/Standup/01-08-2025,application/vnd.google-apps.document,2025-01-08T20:27:53.716Z,pcuenco@elhaynes.org,3091,,1RZ6OPXKNMeUSsAVENgawgvpqRFi0BOIi
1gCY6a7tlbYJNg1As0ppObREyO9l9son0_Hc_FoqlVe4,01-03-2025,/My Drive/Meeting Notes/Standup/01-03-2025,application/vnd.google-apps.document,2025-01-03T20:12:04.727Z,pcuenco@elhaynes.org,2225,,1RZ6OPXKNMeUSsAVENgawgvpqRFi0BOIi
1zD_OjDkHKFiyI6LkeEcH2mRqLBQVUyTMXjbvgVlIfZg,12-20,/My Drive/Meeting Notes/Standup/12-20,application/vnd.google-apps.document,2024-12-20T20:09:12.997Z,pcuenco@elhaynes.org,3588,,1RZ6OPXKNMeUSsAVENgawgvpqRFi0BOIi
1xaS-qV4riYzSFf3cleUt2mDUDjbyNyitFf-Fz0m1vR0,12-9,/My Drive/Meeting Notes/Standup/12-9,application/vnd.google-apps.document,2024-12-13T20:11:59.174Z,pcuenco@elhaynes.org,3240,,1RZ6OPXKNMeUSsAVENgawgvpqRFi0BOIi
1SSidPl_fF3jfj30LN_xPyQ1n1FIqRFJbLu18Uvy5v9M,Stand up Notes,/My Drive/Meeting Notes/Standup/Stand up Notes,application/vnd.google-apps.document,2024-11-18T20:03:32.434Z,pcuenco@elhaynes.org,2691,,1RZ6OPXKNMeUSsAVENgawgvpqRFi0BOIi
1e4b7NgLEq6xajv0jOkriD-IsG7lcnI-qJOCJM57vkbs,tickets 12-1,/My Drive/Reports/tickets 12-1,application/vnd.google-apps.spreadsheet,2024-12-12T14:15:19.761Z,pcuenco@elhaynes.org,4608,,1UWiFBnt3fYQONCssVzTFCt4GIBHy50Nm
1_dt7ko5oCx5QdA9skmCQRYuG45QnDiEf16C8I_-gMro,tickets 12-2,/My Drive/Reports/tickets 12-2,application/vnd.google-apps.spreadsheet,2024-12-11T14:55:49.490Z,pcuenco@elhaynes.org,2660,,1UWiFBnt3fYQONCssVzTFCt4GIBHy50Nm
1gjm7C3dmWkQYVoOfln1mlkAR_ojR6N4ECycqhJrQmls,MS Assessment Collection - Jan 10 2025,/My Drive/Assessments/MS Assessment Collection - Jan 10 2025,application/vnd.google-apps.spreadsheet,2025-01-10T16:06:59.058Z,pcuenco@elhaynes.org,12137,,1RMoePQwwX_XxF8wq6emgS28kPqDMhOU0
1ZLGeF2xvJBGMyuSIxZ0_8XqAUgf7u14_,MS Assessment Collection - Mar 28 2024.xlsx,/My Drive/Assessments/MS Assessment Collection - Mar 28 2024.xlsx,application/vnd.openxmlformats-officedocument.spreadsheetml.sheet,2025-01-09T18:25:27.047Z,pcuenco@elhaynes.org,36956,,1RMoePQwwX_XxF8wq6emgS28kPqDMhOU0
1fHBv1B7a98HuBAaEql06JQP8lnMTncNY,MS Assessment - Jan 2025 .xlsx,/My Drive/Assessments/MS Assessment - Jan 2025 .xlsx,application/vnd.openxmlformats-officedocument.spreadsheetml.sheet,2025-01-09T18:01:37.609Z,pcuenco@elhaynes.org,41666,,1RMoePQwwX_XxF8wq6emgS28kPqDMhOU0
1jNhN7NUTgMKjNtavMKpywrA4fuZzv52H,Copy of MS Assessment Collection - Mar 28 2024.xlsx,/My Drive/Assessments/Copy of MS Assessment Collection - Mar 28 2024.xlsx,application/vnd.openxmlformats-officedocument.spreadsheetml.sheet,2025-01-09T17:57:06.712Z,pcuenco@elhaynes.org,36940,,1RMoePQwwX_XxF8wq6emgS28kPqDMhOU0
19qOc1Q8YqO0uzobUzPKxhwAlxCsXSCBz1t5OloALyF8,User_Download_30092025_152638,/My Drive/Google Admin Downloads/User_Download_30092025_152638,application/vnd.google-apps.spreadsheet,2025-09-30T19:33:25.038Z,pcuenco@elhaynes.org,12514,,0B3ZG-qV0huDxfkhWRlJ4SXFmNG9pVGdYTTFTWFVPSDJpLTZ5ZG9EY2dvNnlWZXVjSHBhR2s
1jo5vJlPoQhGC6HUUyUNCZ-o_vc6A_TkgMy4qx6s5Qlw,User_Download_15082025_142741,/My Drive/Google Admin Downloads/User_Download_15082025_142741,application/vnd.google-apps.spreadsheet,2025-08-15T18:28:00.262Z,pcuenco@elhaynes.org,1181,,0B3ZG-qV0huDxfkhWRlJ4SXFmNG9pVGdYTTFTWFVPSDJpLTZ5ZG9EY2dvNnlWZXVjSHBhR2s
1BciI7G9vTw5bRrgHGn2XZtNu2W65njXnhWKrCUT2eV0,User_Download_15082025_123235,/My Drive/Google Admin Downloads/User_Download_15082025_123235,application/vnd.google-apps.spreadsheet,2025-08-15T16:36:23.493Z,pcuenco@elhaynes.org,109385,,0B3ZG-qV0huDxfkhWRlJ4SXFmNG9pVGdYTTFTWFVPSDJpLTZ5ZG9EY2dvNnlWZXVjSHBhR2s
11v1Iq0pwwFC8DCazdBYz7QH5vs2xvFHl24TXb21fBw0,User_Download_15082025_101452,/My Drive/Google Admin Downloads/User_Download_15082025_101452,application/vnd.google-apps.spreadsheet,2025-08-15T14:58:04.403Z,pcuenco@elhaynes.org,109386,,0B3ZG-qV0huDxfkhWRlJ4SXFmNG9pVGdYTTFTWFVPSDJpLTZ5ZG9EY2dvNnlWZXVjSHBhR2s
1oVIULFC_shFep1_IeGZ43wrHH7dEA9ZP_YY4NX3VhMw,User_Download_15082025_102402,/My Drive/Google Admin Downloads/User_Download_15082025_102402,application/vnd.google-apps.spreadsheet,2025-08-15T14:24:59.716Z,pcuenco@elhaynes.org,3614,,0B3ZG-qV0huDxfkhWRlJ4SXFmNG9pVGdYTTFTWFVPSDJpLTZ5ZG9EY2dvNnlWZXVjSHBhR2s
1OB9HvAYdxHFRg55VW50XFeWdR1z9LJSzMbHBN0Sa-Gs,User_Download_15082025_102420,/My Drive/Google Admin Downloads/User_Download_15082025_102420,application/vnd.google-apps.spreadsheet,2025-08-15T14:24:26.891Z,pcuenco@elhaynes.org,5639,,0B3ZG-qV0huDxfkhWRlJ4SXFmNG9pVGdYTTFTWFVPSDJpLTZ5ZG9EY2dvNnlWZXVjSHBhR2s
1ieDXrqCnzw7qsczLd876NJlqBcr-v62AEepapjPZGh0,User_Download_15082025_102412,/My Drive/Google Admin Downloads/User_Download_15082025_102412,application/vnd.google-apps.spreadsheet,2025-08-15T14:24:17.930Z,pcuenco@elhaynes.org,2399,,0B3ZG-qV0huDxfkhWRlJ4SXFmNG9pVGdYTTFTWFVPSDJpLTZ5ZG9EY2dvNnlWZXVjSHBhR2s
14qCysHZKMoYFRs5LCV6j_T75El0ptX8A6besAznN4QU,User_Download_15082025_101403,/My Drive/Google Admin Downloads/User_Download_15082025_101403,application/vnd.google-apps.spreadsheet,2025-08-15T14:14:36.739Z,pcuenco@elhaynes.org,109390,,0B3ZG-qV0huDxfkhWRlJ4SXFmNG9pVGdYTTFTWFVPSDJpLTZ5ZG9EY2dvNnlWZXVjSHBhR2s
1FLxzEoGWJeB3h32klS_TIEmPvJL_wXatvO4dgx303ng,User_Download_15082025_100829,/My Drive/Google Admin Downloads/User_Download_15082025_100829,application/vnd.google-apps.spreadsheet,2025-08-15T14:09:32.609Z,pcuenco@elhaynes.org,9715,,0B3ZG-qV0huDxfkhWRlJ4SXFmNG9pVGdYTTFTWFVPSDJpLTZ5ZG9EY2dvNnlWZXVjSHBhR2s
1Hox_dscsVLvCDuFbYRzK_WaqrorbMYXv6_KGKtjdqUk,Members_02p2csry39ylmyc_04082025_215157.csv,/My Drive/Google Admin Downloads/Members_02p2csry39ylmyc_04082025_215157.csv,application/vnd.google-apps.spreadsheet,2025-08-05T01:52:31.967Z,pcuenco@elhaynes.org,5723,,0B3ZG-qV0huDxfkhWRlJ4SXFmNG9pVGdYTTFTWFVPSDJpLTZ5ZG9EY2dvNnlWZXVjSHBhR2s
1g1gzUyX0dV6qioxKV3qWi_r92np5w7RP6KfZ4PV6ED8,Staff Disabled,/My Drive/Google Admin Downloads/Staff Disabled,application/vnd.google-apps.spreadsheet,2024-12-20T18:39:16.321Z,pcuenco@elhaynes.org,5194,,0B3ZG-qV0huDxfkhWRlJ4SXFmNG9pVGdYTTFTWFVPSDJpLTZ5ZG9EY2dvNnlWZXVjSHBhR2s
1Ye7R1ECnBUMY0-fRMcFpkTl4pCDdPHqGR9b7FJHE6Ak,Student Disabled OU,/My Drive/Google Admin Downloads/Student Disabled OU,application/vnd.google-apps.spreadsheet,2024-12-20T18:37:06.843Z,pcuenco@elhaynes.org,61914,,0B3ZG-qV0huDxfkhWRlJ4SXFmNG9pVGdYTTFTWFVPSDJpLTZ5ZG9EY2dvNnlWZXVjSHBhR2s
1At_E2-1AOZ3eMidiBJh8EbaOjdqYbBiNEAure_-n0o4,Accounts to delete - Group 1,/My Drive/User Deletions/Accounts to delete - Group 1,application/vnd.google-apps.spreadsheet,2025-01-03T16:49:23.060Z,pcuenco@elhaynes.org,2993,,1-LfY7U5Ut1U8o7zthZCU40e-8WCDKbxr
1k6AYLLOqjnM-KBA3mEMS_0Pjrn-0HKQT9Hp-mbwWnfA,Alexandria - Peter,/My Drive/Scripts/Alexandria - Peter,application/vnd.google-apps.document,2025-09-18T18:16:23.440Z,pcuenco@elhaynes.org,1024,,17-dy7FUff03rCjGv5aaX2INzj85dI0Kn
18wK3uJYGvC8B7kzwQxBJQytZtIGDZ23M,output0205.csv,/My Drive/Scripts/output0205.csv,text/csv,2025-02-05T16:49:21.765Z,pcuenco@elhaynes.org,8470,,17-dy7FUff03rCjGv5aaX2INzj85dI0Kn
1A_Hc30vIMh65HyEfEoancNv4WbykLv3T,gamusers-new.ps1,/My Drive/Scripts/gamusers-new.ps1,application/octet-stream,2025-02-05T16:46:37.698Z,pcuenco@elhaynes.org,999,,17-dy7FUff03rCjGv5aaX2INzj85dI0Kn
14rpsWpzp02GheK0AWbD8_p0b57iKLFkP,gamusers.ps1,/My Drive/Scripts/gamusers.ps1,application/octet-stream,2025-02-05T16:46:18.201Z,pcuenco@elhaynes.org,944,,17-dy7FUff03rCjGv5aaX2INzj85dI0Kn
1X5_IwlRgmADxOKU-looXLVdIP-qFKzkB,users0205.csv,/My Drive/Scripts/users0205.csv,text/csv,2025-02-05T16:45:13.750Z,pcuenco@elhaynes.org,4066,,17-dy7FUff03rCjGv5aaX2INzj85dI0Kn
1aQWr-6sO6TVPkUkDPPjVqmV-lIbVGC59,users0205.xlsx,/My Drive/Scripts/users0205.xlsx,application/vnd.openxmlformats-officedocument.spreadsheetml.sheet,2025-02-05T16:43:57.074Z,pcuenco@elhaynes.org,11149,,17-dy7FUff03rCjGv5aaX2INzj85dI0Kn
1on6JHx4aqYXCgGHw5kA_LcjhJUjojgFe,output.csv,/My Drive/Scripts/output.csv,text/csv,2025-02-05T16:27:28.697Z,pcuenco@elhaynes.org,7490,,17-dy7FUff03rCjGv5aaX2INzj85dI0Kn
1oayI0bhmQw03WJidbpToyCeXUYNVA4Qd,speed1.py,/My Drive/Scripts/speed1.py,text/x-python,2025-01-31T19:35:01.896Z,pcuenco@elhaynes.org,2197,,17-dy7FUff03rCjGv5aaX2INzj85dI0Kn
1yNACBX8Ty-QE0u_wOQRVKH9PNfqSp7ho,__pycache__,/My Drive/Scripts/__pycache__,application/vnd.google-apps.folder,2025-01-31T19:27:30.773Z,pcuenco@elhaynes.org,,,17-dy7FUff03rCjGv5aaX2INzj85dI0Kn
1YKY8kuCqvkkw9XZMhbCtTznaWHp6oEw9,speed.py,/My Drive/Scripts/speed.py,text/x-python,2025-01-31T19:27:09.326Z,pcuenco@elhaynes.org,1897,,17-dy7FUff03rCjGv5aaX2INzj85dI0Kn
1iZ3EFPpFMZrv7Omt3l3SYkFbY1_UhzcU,dailyrun02.ps1,/My Drive/Scripts/dailyrun02.ps1,application/octet-stream,2025-01-31T18:01:30.384Z,pcuenco@elhaynes.org,3677,,17-dy7FUff03rCjGv5aaX2INzj85dI0Kn
1kbQCTnzN4CwBTggCWw4Cictxq3GJ7Byp,delete_users_test.csv,/My Drive/Scripts/delete_users_test.csv,text/csv,2025-01-23T19:39:35.411Z,pcuenco@elhaynes.org,489,,17-dy7FUff03rCjGv5aaX2INzj85dI0Kn
1kx6IP4-wVE-4V4vPAVSaPu0yW-NT4789,1_delete_users_test.csv,/My Drive/Scripts/1_delete_users_test.csv,text/csv,2025-01-23T19:34:24.062Z,pcuenco@elhaynes.org,201,,17-dy7FUff03rCjGv5aaX2INzj85dI0Kn
1eh5sE-gW9GpxbEQW0uYs2o0psV3_fxxm,deleteusers.ps1,/My Drive/Scripts/deleteusers.ps1,application/octet-stream,2025-01-23T19:31:34.504Z,pcuenco@elhaynes.org,675,,17-dy7FUff03rCjGv5aaX2INzj85dI0Kn
1IUBPJD_U0K0rQkgbBKaJ_BW8aWrb2GUC,[1]deleteusers.ps1,/My Drive/Scripts/[1]deleteusers.ps1,application/octet-stream,2025-01-23T19:28:09.636Z,pcuenco@elhaynes.org,804,,17-dy7FUff03rCjGv5aaX2INzj85dI0Kn
1JJT9NOfsaaDzjoMteoooug0SXDJJCqjY,OG-deleteusers.ps1,/My Drive/Scripts/OG-deleteusers.ps1,application/octet-stream,2025-01-23T19:17:38.803Z,pcuenco@elhaynes.org,518,,17-dy7FUff03rCjGv5aaX2INzj85dI0Kn
18vJQIg1FIMIBdiv709ZwjoM6qKmemO9j,Accounts to delete - Group 1.xlsx,/My Drive/Scripts/Accounts to delete - Group 1.xlsx,application/vnd.openxmlformats-officedocument.spreadsheetml.sheet,2025-01-03T16:43:21.939Z,pcuenco@elhaynes.org,14864,,17-dy7FUff03rCjGv5aaX2INzj85dI0Kn
1PyPh_IVtZeIHj3nPj5EoGLbE2yXAUPRK,02-05-2025-output.csv,/My Drive/Scripts/02-05-2025-output.csv,text/csv,2025-01-03T16:42:43.551Z,pcuenco@elhaynes.org,8747,,17-dy7FUff03rCjGv5aaX2INzj85dI0Kn
1tcP3Q5rxDGYuAIX-szhqaGzW62808s8O,users.csv,/My Drive/Scripts/users.csv,text/csv,2025-01-03T15:29:44.609Z,pcuenco@elhaynes.org,3075,,17-dy7FUff03rCjGv5aaX2INzj85dI0Kn
1TtXqs3WlWI0RSV066mpQqsg4thVMbO3q,users - Copy.csv,/My Drive/Scripts/users - Copy.csv,text/csv,2025-01-03T13:54:01.881Z,pcuenco@elhaynes.org,128682,,17-dy7FUff03rCjGv5aaX2INzj85dI0Kn
1fE6nL6-9gx1o1q5XA-WX9DBHlxDaaM38,servers2.txt,/My Drive/Scripts/servers2.txt,text/plain,2024-11-19T13:51:12.945Z,pcuenco@elhaynes.org,997,,17-dy7FUff03rCjGv5aaX2INzj85dI0Kn
1TN0Zb2upkNys81cAuxde2Rv4Hk-7R2Lw,qualys.txt,/My Drive/Scripts/qualys.txt,text/plain,2024-11-12T16:33:31.975Z,pcuenco@elhaynes.org,228,,17-dy7FUff03rCjGv5aaX2INzj85dI0Kn
1UPpQMW8eWJ7wDIdQ1kWbjQAoLP7TdqNl,server-drive-check.txt,/My Drive/Scripts/server-drive-check.txt,text/plain,2024-11-01T20:01:32.980Z,pcuenco@elhaynes.org,18,,17-dy7FUff03rCjGv5aaX2INzj85dI0Kn
1WmkhW-L77watY5sFad9_lY9EOhx-aX1W,drive-check.ps1,/My Drive/Scripts/drive-check.ps1,application/octet-stream,2024-11-01T20:00:38.186Z,pcuenco@elhaynes.org,1237,,17-dy7FUff03rCjGv5aaX2INzj85dI0Kn
1H1nZ0UMqJ3nkdoWSIhpqy4BYiGtLfoxj,server_status.txt,/My Drive/Scripts/server_status.txt,text/plain,2024-11-01T19:49:45.743Z,pcuenco@elhaynes.org,333,,17-dy7FUff03rCjGv5aaX2INzj85dI0Kn
1zJGi1_Ugp-BtVM1B9NwyLeJ75l7VE7uP,sweep1.py,/My Drive/Scripts/sweep1.py,text/x-python,2024-11-01T19:45:07.721Z,pcuenco@elhaynes.org,3769,,17-dy7FUff03rCjGv5aaX2INzj85dI0Kn
1U95sBy-h30PSRmhioaqceGGL3mGk8knx,gen-password.py,/My Drive/Scripts/gen-password.py,text/x-python,2024-11-01T18:34:12.231Z,pcuenco@elhaynes.org,343,,17-dy7FUff03rCjGv5aaX2INzj85dI0Kn
1Q95C5KZyJzmsosN6uX1t_ANbn7pRF_Vn,dailyrun01.ps1,/My Drive/Scripts/dailyrun01.ps1,application/octet-stream,2024-10-31T14:02:13.622Z,pcuenco@elhaynes.org,3071,,17-dy7FUff03rCjGv5aaX2INzj85dI0Kn
1vnMQrjaaw_IarLLRm3q8ofmhU2pRfV0E,servers.txt,/My Drive/Scripts/servers.txt,text/plain,2024-10-31T14:01:04.167Z,pcuenco@elhaynes.org,428,,17-dy7FUff03rCjGv5aaX2INzj85dI0Kn
1_QCbYro35mLS3soyv6yd2IlBSHse8Hga,singlerunsweep.ps1,/My Drive/Scripts/singlerunsweep.ps1,application/octet-stream,2024-10-31T13:57:52.272Z,pcuenco@elhaynes.org,3204,,17-dy7FUff03rCjGv5aaX2INzj85dI0Kn
1f7ZH2u7KIbdoXB7SZDWDnoZ4Mo7hZBWN,singlerunsweep1.ps1,/My Drive/Scripts/singlerunsweep1.ps1,application/octet-stream,2024-10-31T13:53:52.928Z,pcuenco@elhaynes.org,3235,,17-dy7FUff03rCjGv5aaX2INzj85dI0Kn
1CG2-pvrSyyHbdw_Ayy0RrEvhhWOAKKgZ,ServerStatus.json,/My Drive/Scripts/ServerStatus.json,application/json,2024-10-30T18:23:54.896Z,pcuenco@elhaynes.org,191,,17-dy7FUff03rCjGv5aaX2INzj85dI0Kn
11yEEiLOCQwQ47J1IjBGtNP7pRB7KQTWB,pingsweep3.ps1,/My Drive/Scripts/pingsweep3.ps1,application/octet-stream,2024-10-30T18:23:14.410Z,pcuenco@elhaynes.org,4705,,17-dy7FUff03rCjGv5aaX2INzj85dI0Kn
1ribDwjcoT_wRKCVuT495cYBR3fm0Ta0-,pingsweep.ps1,/My Drive/Scripts/pingsweep.ps1,application/octet-stream,2024-10-28T14:02:48.788Z,pcuenco@elhaynes.org,1149,,17-dy7FUff03rCjGv5aaX2INzj85dI0Kn
15IVYdB_h9Ap1rEIWOU29mwbbUnXoZKXT,pingsweep2.ps1,/My Drive/Scripts/pingsweep2.ps1,application/octet-stream,2024-10-28T13:57:30.285Z,pcuenco@elhaynes.org,2843,,17-dy7FUff03rCjGv5aaX2INzj85dI0Kn
1VFJ7uFGau5Hkd6vcXnj6z1VsLP-1nqMd,sweepwithtext.ps1,/My Drive/Scripts/sweepwithtext.ps1,application/octet-stream,2024-10-28T13:37:17.283Z,pcuenco@elhaynes.org,2553,,17-dy7FUff03rCjGv5aaX2INzj85dI0Kn
1bmNedEakZ_bG6cSFGI3vu3JAqcDEDoH3,sweepwithsmtp.ps1,/My Drive/Scripts/sweepwithsmtp.ps1,application/octet-stream,2024-10-28T13:24:19.551Z,pcuenco@elhaynes.org,3655,,17-dy7FUff03rCjGv5aaX2INzj85dI0Kn
1OQ8KtUL55mYOuwkBHA44-IBQa04_Cv70,servers.docx,/My Drive/Scripts/servers.docx,application/vnd.openxmlformats-officedocument.wordprocessingml.document,2024-10-28T13:19:17.324Z,pcuenco@elhaynes.org,11958,,17-dy7FUff03rCjGv5aaX2INzj85dI0Kn
1lghjd6P_hQl6FltxVMe5Hc9Ub73FO6jZ,pingsweep.docx,/My Drive/Scripts/pingsweep.docx,application/vnd.openxmlformats-officedocument.wordprocessingml.document,2024-10-24T14:33:44.191Z,pcuenco@elhaynes.org,11886,,17-dy7FUff03rCjGv5aaX2INzj85dI0Kn
1nySAxpL-yM5PW7emPc53kyVodn2fQauj,speedtest.cpython-312.pyc,/My Drive/Scripts/__pycache__/speedtest.cpython-312.pyc,application/x-python-code,2025-01-31T19:27:30.771Z,pcuenco@elhaynes.org,2548,,1yNACBX8Ty-QE0u_wOQRVKH9PNfqSp7ho
1nsUj4oGxns5ac56iDaVjbfvx2KASEUi2w_9xMrdAmow,IT Ops standup [M/W/F] - 2025/10/08 15:00 EDT - Notes by Gemini,/My Drive/Meet Recordings/IT Ops standup [M/W/F] - 2025/10/08 15:00 EDT - Notes by Gemini,application/vnd.google-apps.document,2025-10-08T19:25:33.682Z,pcuenco@elhaynes.org,15245,,1Dv_7sFwxdCiVCbGcLx-9LEE7ec-Soi7h
1lZqY-GeUuanfrYwV8ySreeEIDRtQhhKwFiXj872MKgU,Weekly tech with DNS - 2025/10/07 13:30 EDT - Transcript,/My Drive/Meet Recordings/Weekly tech with DNS - 2025/10/07 13:30 EDT - Transcript,application/vnd.google-apps.document,2025-10-07T18:35:19.566Z,pcuenco@elhaynes.org,12867,,1Dv_7sFwxdCiVCbGcLx-9LEE7ec-Soi7h
18nLO0GvYbWeDPeXDY3T7Nu8KashfHFzIBkapLLSbn5E,IT Ops standup [M/W/F] - 2025/10/01 15:03 EDT - Notes by Gemini,/My Drive/Meet Recordings/IT Ops standup [M/W/F] - 2025/10/01 15:03 EDT - Notes by Gemini,application/vnd.google-apps.document,2025-10-01T19:13:46.946Z,pcuenco@elhaynes.org,8631,,1Dv_7sFwxdCiVCbGcLx-9LEE7ec-Soi7h
1oWwLxUCuLQBIv0Q4B8oE0MGDtRPyRaISa2IpJJaZSzg,IT Ops standup [M/W/F] - 2025/09/17 14:56 EDT - Notes by Gemini,/My Drive/Meet Recordings/IT Ops standup [M/W/F] - 2025/09/17 14:56 EDT - Notes by Gemini,application/vnd.google-apps.document,2025-09-17T19:28:05.459Z,pcuenco@elhaynes.org,18065,,1Dv_7sFwxdCiVCbGcLx-9LEE7ec-Soi7h
18AgRNoN4jICy1xfgfWchuV-ZxiMZsCbAt1jSA3KlnTg,IT Ops standup [M/W/F] - 2025/09/15 14:56 EDT - Notes by Gemini,/My Drive/Meet Recordings/IT Ops standup [M/W/F] - 2025/09/15 14:56 EDT - Notes by Gemini,application/vnd.google-apps.document,2025-09-15T19:15:19.000Z,pcuenco@elhaynes.org,12927,,1Dv_7sFwxdCiVCbGcLx-9LEE7ec-Soi7h
1l2Gj6nxgFi5zdaAPYmBwyUIfdjTS4cWwklwv4l1_0A0,IT Ops standup [M/W/F] - 2025/09/05 14:47 EDT - Notes by Gemini,/My Drive/Meet Recordings/IT Ops standup [M/W/F] - 2025/09/05 14:47 EDT - Notes by Gemini,application/vnd.google-apps.document,2025-09-05T19:05:36.952Z,pcuenco@elhaynes.org,12780,,1Dv_7sFwxdCiVCbGcLx-9LEE7ec-Soi7h
1mF69jtaCKeb3EH0YhVRa21sJQtXVRV98KArKlrKqOcw,Meeting started 2025/09/04 10:46 EDT - Notes by Gemini,/My Drive/Meet Recordings/Meeting started 2025/09/04 10:46 EDT - Notes by Gemini,application/vnd.google-apps.document,2025-09-04T15:13:42.266Z,pcuenco@elhaynes.org,17376,,1Dv_7sFwxdCiVCbGcLx-9LEE7ec-Soi7h
19r8LpK9YaWjsyGZzLcZI-MTUEOdTsMkk1ReY-WEvp4s,IT Ops standup [M/W/F] - 2025/09/03 14:47 EDT - Notes by Gemini,/My Drive/Meet Recordings/IT Ops standup [M/W/F] - 2025/09/03 14:47 EDT - Notes by Gemini,application/vnd.google-apps.document,2025-09-03T19:28:18.302Z,pcuenco@elhaynes.org,23760,,1Dv_7sFwxdCiVCbGcLx-9LEE7ec-Soi7h
101Cg2z1y2Zk7m82PJgbpmL8BpUe8-dki,ins-wsjj-civ (2025-07-11 12:13 GMT-4),/My Drive/Meet Recordings/ins-wsjj-civ (2025-07-11 12:13 GMT-4),video/mp4,2025-07-11T18:15:58.464Z,pcuenco@elhaynes.org,655121215,,1Dv_7sFwxdCiVCbGcLx-9LEE7ec-Soi7h
1eonWkkkxm-bVga5bLBsxiMAdV6UnQ-t24eS6R8z9Ye4,ins-wsjj-civ (2025-07-11 12:13 GMT-4) - Transcript,/My Drive/Meet Recordings/ins-wsjj-civ (2025-07-11 12:13 GMT-4) - Transcript,application/vnd.google-apps.document,2025-07-11T17:30:32.576Z,pcuenco@elhaynes.org,22405,,1Dv_7sFwxdCiVCbGcLx-9LEE7ec-Soi7h
1woRrMJnPBdyb_rpurNCTSrZaSnCgcBjp,Weekly 1-1: Jose/Peter - 2025/04/24 15:31 EDT - Recording,/My Drive/Meet Recordings/Weekly 1-1: Jose/Peter - 2025/04/24 15:31 EDT - Recording,video/mp4,2025-04-24T21:36:34.818Z,pcuenco@elhaynes.org,374479160,,1Dv_7sFwxdCiVCbGcLx-9LEE7ec-Soi7h
1DXo9NzLbb4TyVsE8dJfwnmG8MjVYHf2CjnSR_rqY8rQ,Weekly 1-1: Jose/Peter - 2025/04/24 15:31 EDT - Transcript,/My Drive/Meet Recordings/Weekly 1-1: Jose/Peter - 2025/04/24 15:31 EDT - Transcript,application/vnd.google-apps.document,2025-04-24T21:26:59.714Z,pcuenco@elhaynes.org,29820,,1Dv_7sFwxdCiVCbGcLx-9LEE7ec-Soi7h
1DJKvRbQeClHxwf49OHKYevCrNvD4HnKc,Weekly tech with DNS - 2025/04/22 13:29 EDT - Recording,/My Drive/Meet Recordings/Weekly tech with DNS - 2025/04/22 13:29 EDT - Recording,video/mp4,2025-04-22T18:47:18.435Z,pcuenco@elhaynes.org,90537356,,1Dv_7sFwxdCiVCbGcLx-9LEE7ec-Soi7h
1iwYh1DW2f4UYAGoHFs_a_Tl-HG0pUMPlfgDS7gUandg,Weekly tech with DNS - 2025/04/22 13:29 EDT - Transcript,/My Drive/Meet Recordings/Weekly tech with DNS - 2025/04/22 13:29 EDT - Transcript,application/vnd.google-apps.document,2025-04-22T18:13:45.923Z,pcuenco@elhaynes.org,13575,,1Dv_7sFwxdCiVCbGcLx-9LEE7ec-Soi7h
1V-ZbsnoOR_9SrReqq8ARCuE_bk5M4U4s_lGkUp3zkYA,Weekly tech with DNS - 2025/04/08 13:28 EDT - Transcript,/My Drive/Meet Recordings/Weekly tech with DNS - 2025/04/08 13:28 EDT - Transcript,application/vnd.google-apps.document,2025-04-22T15:28:14.836Z,pcuenco@elhaynes.org,2141,,1Dv_7sFwxdCiVCbGcLx-9LEE7ec-Soi7h
1DPBcMJokmoULkI0OEII--t2pYgcGJ-Bx,IT Ops standup [M/W/F] - 2025/04/11 14:43 EDT - Recording,/My Drive/Meet Recordings/IT Ops standup [M/W/F] - 2025/04/11 14:43 EDT - Recording,video/mp4,2025-04-11T19:39:50.220Z,pcuenco@elhaynes.org,87182290,,1Dv_7sFwxdCiVCbGcLx-9LEE7ec-Soi7h
1FiHQw88NZQXtr58f6CqHmmPxpvbdlmBPlVJ3SzYcluw,IT Ops standup [M/W/F] - 2025/04/11 14:43 EDT - Transcript,/My Drive/Meet Recordings/IT Ops standup [M/W/F] - 2025/04/11 14:43 EDT - Transcript,application/vnd.google-apps.document,2025-04-11T19:39:26.658Z,pcuenco@elhaynes.org,13848,,1Dv_7sFwxdCiVCbGcLx-9LEE7ec-Soi7h
1gUOYhZ_aTQ42m09ObHKswPzalBdqFCqP,Weekly tech with DNS - 2025/04/08 13:28 EDT - Recording,/My Drive/Meet Recordings/Weekly tech with DNS - 2025/04/08 13:28 EDT - Recording,video/mp4,2025-04-08T17:42:55.810Z,pcuenco@elhaynes.org,18813212,,1Dv_7sFwxdCiVCbGcLx-9LEE7ec-Soi7h
1-MfNfwyTyHRXIbABeZWzCNu1lypGXKdF,IT Ops standup [M/W/F] - 2025/04/08 09:13 EDT - Recording,/My Drive/Meet Recordings/IT Ops standup [M/W/F] - 2025/04/08 09:13 EDT - Recording,video/mp4,2025-04-08T13:22:41.530Z,pcuenco@elhaynes.org,327641,,1Dv_7sFwxdCiVCbGcLx-9LEE7ec-Soi7h
1WqQAockUzNvBO26cRxpcDqDJHqyD5-KvCSbMas0kOJM,IT Ops standup [M/W/F] - 2025/04/07 14:43 EDT - Transcript,/My Drive/Meet Recordings/IT Ops standup [M/W/F] - 2025/04/07 14:43 EDT - Transcript,application/vnd.google-apps.document,2025-04-07T19:51:13.194Z,pcuenco@elhaynes.org,16841,,1Dv_7sFwxdCiVCbGcLx-9LEE7ec-Soi7h
1m_kuyGsr13G4LO6P4MrfXNCdi1kEp50e,IT Ops standup [M/W/F] - 2025/04/07 14:43 EDT - Recording,/My Drive/Meet Recordings/IT Ops standup [M/W/F] - 2025/04/07 14:43 EDT - Recording,video/mp4,2025-04-07T19:40:02.288Z,pcuenco@elhaynes.org,131941003,,1Dv_7sFwxdCiVCbGcLx-9LEE7ec-Soi7h
1fINomcNblKg5qkrjOkm9WIyDNbOZiWt0,2025-09-23 12:06 owt-wqhb-ejd,/My Drive/Meeting Reports/2025-09-23 12:06 owt-wqhb-ejd,application/vnd.google-apps.folder,2025-09-23T17:31:11.364Z,pcuenco@elhaynes.org,,,1YHax2uUtoUfx8Yu65ZvlZ7ulwwcNfdwW
1qY6ep1GlTmdaBK4Unw3q2AfVv79lvgnM,2025-09-17 15:28 dac-fyqh-dwk,/My Drive/Meeting Reports/2025-09-17 15:28 dac-fyqh-dwk,application/vnd.google-apps.folder,2025-09-17T19:41:32.193Z,pcuenco@elhaynes.org,,,1YHax2uUtoUfx8Yu65ZvlZ7ulwwcNfdwW
19qD9speoblPTzXMbOxWFvfdE8P7gGMg6,2025-09-04 10:46 hfh-bskz-xgk,/My Drive/Meeting Reports/2025-09-04 10:46 hfh-bskz-xgk,application/vnd.google-apps.folder,2025-09-04T15:13:43.298Z,pcuenco@elhaynes.org,,,1YHax2uUtoUfx8Yu65ZvlZ7ulwwcNfdwW
1INg4wZIbo84j3RSaOtXpyfxSddIelzfz,2025-08-26 12:50 ero-sqvr-wxo,/My Drive/Meeting Reports/2025-08-26 12:50 ero-sqvr-wxo,application/vnd.google-apps.folder,2025-08-26T17:05:26.312Z,pcuenco@elhaynes.org,,,1YHax2uUtoUfx8Yu65ZvlZ7ulwwcNfdwW
1YlidoQ3jh4MF-KlF0e9ll2q8S5Q2dS1T,2025-07-11 12:04 ins-wsjj-civ,/My Drive/Meeting Reports/2025-07-11 12:04 ins-wsjj-civ,application/vnd.google-apps.folder,2025-07-11T16:55:00.756Z,pcuenco@elhaynes.org,,,1YHax2uUtoUfx8Yu65ZvlZ7ulwwcNfdwW
1s_6wZ6UVLiCS-TQNkwa2JhGDGe88fVIy,2025-07-11 11:01 Tech Needs,/My Drive/Meeting Reports/2025-07-11 11:01 Tech Needs,application/vnd.google-apps.folder,2025-07-11T15:26:23.551Z,pcuenco@elhaynes.org,,,1YHax2uUtoUfx8Yu65ZvlZ7ulwwcNfdwW
11OAMkv9lGIOxPjMjSP4GtlqWPWFS9EDd,2025-06-30 11:07 zdg-fjhb-tcp,/My Drive/Meeting Reports/2025-06-30 11:07 zdg-fjhb-tcp,application/vnd.google-apps.folder,2025-06-30T15:39:51.631Z,pcuenco@elhaynes.org,,,1YHax2uUtoUfx8Yu65ZvlZ7ulwwcNfdwW
1Awc2V6ISVy6SwGAucyDhrjmFbdIrEMoi,2025-06-27 13:44 IT Interns,/My Drive/Meeting Reports/2025-06-27 13:44 IT Interns,application/vnd.google-apps.folder,2025-06-27T17:59:48.922Z,pcuenco@elhaynes.org,,,1YHax2uUtoUfx8Yu65ZvlZ7ulwwcNfdwW
1JmP24tdiYJWUFOLqGz1npHQYenkhdS5T,2025-06-10 10:21 tkk-bcob-pou,/My Drive/Meeting Reports/2025-06-10 10:21 tkk-bcob-pou,application/vnd.google-apps.folder,2025-06-10T14:46:15.022Z,pcuenco@elhaynes.org,,,1YHax2uUtoUfx8Yu65ZvlZ7ulwwcNfdwW
1GlG_QFejV6ipJcEojydrkkHaw0p2XQck,2025-05-30 13:59 ayn-xjnh-fgq,/My Drive/Meeting Reports/2025-05-30 13:59 ayn-xjnh-fgq,application/vnd.google-apps.folder,2025-05-30T18:28:50.136Z,pcuenco@elhaynes.org,,,1YHax2uUtoUfx8Yu65ZvlZ7ulwwcNfdwW
1M_aUpY50fY0TZLSVmcVuwkIVv_RyO_pj,2025-05-28 13:30 Del Sterling,/My Drive/Meeting Reports/2025-05-28 13:30 Del Sterling,application/vnd.google-apps.folder,2025-05-28T17:41:24.611Z,pcuenco@elhaynes.org,,,1YHax2uUtoUfx8Yu65ZvlZ7ulwwcNfdwW
1pQjMFhohiMQt2hAErWi_x8k_wXr099_b,2025-05-23 09:31 cuw-hhzp-hua,/My Drive/Meeting Reports/2025-05-23 09:31 cuw-hhzp-hua,application/vnd.google-apps.folder,2025-05-23T13:59:30.905Z,pcuenco@elhaynes.org,,,1YHax2uUtoUfx8Yu65ZvlZ7ulwwcNfdwW
12Zj-DXnRh_6mmuwoz1K-RFCQGpDWNom1,2025-05-20 15:13 hsp-mfeg-epn,/My Drive/Meeting Reports/2025-05-20 15:13 hsp-mfeg-epn,application/vnd.google-apps.folder,2025-05-20T19:22:17.938Z,pcuenco@elhaynes.org,,,1YHax2uUtoUfx8Yu65ZvlZ7ulwwcNfdwW
17Eg1TPMCI6RTRri7ENdiBcmWbogrzGWk,2025-05-19 09:59 Toni onboarding,/My Drive/Meeting Reports/2025-05-19 09:59 Toni onboarding,application/vnd.google-apps.folder,2025-05-19T14:14:16.189Z,pcuenco@elhaynes.org,,,1YHax2uUtoUfx8Yu65ZvlZ7ulwwcNfdwW
1TrcaWi3_svv0wodoqz5KKYJIMmmLPDpQ,2025-05-14 10:05 xtd-mjyr-qxo,/My Drive/Meeting Reports/2025-05-14 10:05 xtd-mjyr-qxo,application/vnd.google-apps.folder,2025-05-14T14:17:27.344Z,pcuenco@elhaynes.org,,,1YHax2uUtoUfx8Yu65ZvlZ7ulwwcNfdwW
1Zuz7EMX83u3gvAQgJyGyvIlgYcTVoBd2,2025-05-09 09:31 eek-zezs-atx,/My Drive/Meeting Reports/2025-05-09 09:31 eek-zezs-atx,application/vnd.google-apps.folder,2025-05-09T14:09:09.491Z,pcuenco@elhaynes.org,,,1YHax2uUtoUfx8Yu65ZvlZ7ulwwcNfdwW
14aobdi7ZWswAKpV39L_3K4fz4xJZ5d-0,2025-04-10 14:17 jgs-kkta-zmy,/My Drive/Meeting Reports/2025-04-10 14:17 jgs-kkta-zmy,application/vnd.google-apps.folder,2025-04-10T18:30:45.945Z,pcuenco@elhaynes.org,,,1YHax2uUtoUfx8Yu65ZvlZ7ulwwcNfdwW
1n2IaDubiM_YtfK_Ob2Hal09st8UmB2tEq_XDc54XpVk,2025-04-10 14:17 jgs-kkta-zmy Attendance Report,/My Drive/Meeting Reports/2025-04-10 14:17 jgs-kkta-zmy/2025-04-10 14:17 jgs-kkta-zmy Attendance Report,application/vnd.google-apps.spreadsheet,2025-04-10T18:30:43.536Z,pcuenco@elhaynes.org,1024,,14aobdi7ZWswAKpV39L_3K4fz4xJZ5d-0
1O4AfrOdAeFUi_W2gvYJTL04S3wytH77g-n5t97PNldM,2025-05-09 09:31 eek-zezs-atx Attendance Report,/My Drive/Meeting Reports/2025-05-09 09:31 eek-zezs-atx/2025-05-09 09:31 eek-zezs-atx Attendance Report,application/vnd.google-apps.spreadsheet,2025-05-09T14:09:08.352Z,pcuenco@elhaynes.org,1024,,1Zuz7EMX83u3gvAQgJyGyvIlgYcTVoBd2
1LhU2REN6feU_dAlROrK18HjUvhAbu_IuLm9OvamVk30,2025-05-14 10:05 xtd-mjyr-qxo Attendance Report,/My Drive/Meeting Reports/2025-05-14 10:05 xtd-mjyr-qxo/2025-05-14 10:05 xtd-mjyr-qxo Attendance Report,application/vnd.google-apps.spreadsheet,2025-05-14T14:17:26.129Z,pcuenco@elhaynes.org,1024,,1TrcaWi3_svv0wodoqz5KKYJIMmmLPDpQ
1_AwtBM1xydRbHBSZdbMzHvzkYFc7PJQ_UuaGdRAtPGM,Toni onboarding - 2025/05/19 09:59 EDT - Attendance,/My Drive/Meeting Reports/2025-05-19 09:59 Toni onboarding/Toni onboarding - 2025/05/19 09:59 EDT - Attendance,application/vnd.google-apps.spreadsheet,2025-05-19T14:14:14.875Z,pcuenco@elhaynes.org,1024,,17Eg1TPMCI6RTRri7ENdiBcmWbogrzGWk
1cK7aZjJnomMIavJ1kAVvEMgtNSVMubBST64DLcJTw5M,2025-05-20 15:13 hsp-mfeg-epn Attendance Report,/My Drive/Meeting Reports/2025-05-20 15:13 hsp-mfeg-epn/2025-05-20 15:13 hsp-mfeg-epn Attendance Report,application/vnd.google-apps.spreadsheet,2025-05-20T19:22:17.186Z,pcuenco@elhaynes.org,1024,,12Zj-DXnRh_6mmuwoz1K-RFCQGpDWNom1
11YSjMLHsAm8GZgIOhM4vsQn9rc1xy0HTrI4pDekCF5M,2025-05-23 09:31 cuw-hhzp-hua Attendance Report,/My Drive/Meeting Reports/2025-05-23 09:31 cuw-hhzp-hua/2025-05-23 09:31 cuw-hhzp-hua Attendance Report,application/vnd.google-apps.spreadsheet,2025-05-23T13:59:29.650Z,pcuenco@elhaynes.org,1024,,1pQjMFhohiMQt2hAErWi_x8k_wXr099_b
1Tjw5kAtlhhQExQ7uLuLVkF4OoECTL0zWvGe5Lqg4lBY,Del Sterling - 2025/05/28 13:30 EDT - Attendance,/My Drive/Meeting Reports/2025-05-28 13:30 Del Sterling/Del Sterling - 2025/05/28 13:30 EDT - Attendance,application/vnd.google-apps.spreadsheet,2025-05-28T17:41:23.011Z,pcuenco@elhaynes.org,1024,,1M_aUpY50fY0TZLSVmcVuwkIVv_RyO_pj
1sbweNx8gkx7IIGeo_db_AhhU5zh0uGCwtWUBnbQb7g4,2025-05-30 13:59 ayn-xjnh-fgq Attendance Report,/My Drive/Meeting Reports/2025-05-30 13:59 ayn-xjnh-fgq/2025-05-30 13:59 ayn-xjnh-fgq Attendance Report,application/vnd.google-apps.spreadsheet,2025-05-30T18:28:48.473Z,pcuenco@elhaynes.org,1024,,1GlG_QFejV6ipJcEojydrkkHaw0p2XQck
1xXEVxxkjXSLb8mhjWl9xIDpLbBEe_8lwIhVdNL4MJ1A,2025-06-10 10:21 tkk-bcob-pou Attendance Report,/My Drive/Meeting Reports/2025-06-10 10:21 tkk-bcob-pou/2025-06-10 10:21 tkk-bcob-pou Attendance Report,application/vnd.google-apps.spreadsheet,2025-06-10T14:46:13.818Z,pcuenco@elhaynes.org,1024,,1JmP24tdiYJWUFOLqGz1npHQYenkhdS5T
1VRp_EMKdd21M_xreSh8qeMTKFOZ7Ugo9mj34DXMVIME,IT Interns - 2025/06/27 13:44 EDT - Attendance,/My Drive/Meeting Reports/2025-06-27 13:44 IT Interns/IT Interns - 2025/06/27 13:44 EDT - Attendance,application/vnd.google-apps.spreadsheet,2025-06-27T17:59:47.391Z,pcuenco@elhaynes.org,1024,,1Awc2V6ISVy6SwGAucyDhrjmFbdIrEMoi
1C5-cylEziVkkbp4kI4r_cZwKVv6d95goq8y5c6VaaV4,2025-06-30 11:07 zdg-fjhb-tcp Attendance Report,/My Drive/Meeting Reports/2025-06-30 11:07 zdg-fjhb-tcp/2025-06-30 11:07 zdg-fjhb-tcp Attendance Report,application/vnd.google-apps.spreadsheet,2025-06-30T15:39:50.627Z,pcuenco@elhaynes.org,1024,,11OAMkv9lGIOxPjMjSP4GtlqWPWFS9EDd
1dAe0P_vnEEAyIeqfqzIcaEMjMyNzIPHaO6KDYXB-f1I,Tech Needs - 2025/07/11 11:01 EDT - Attendance,/My Drive/Meeting Reports/2025-07-11 11:01 Tech Needs/Tech Needs - 2025/07/11 11:01 EDT - Attendance,application/vnd.google-apps.spreadsheet,2025-07-11T15:26:22.580Z,pcuenco@elhaynes.org,1024,,1s_6wZ6UVLiCS-TQNkwa2JhGDGe88fVIy
17T3C0Kkp5EUjVbmLhPRqKo5tsTGmXjYbyjjnIrDZjag,2025-07-11 12:04 ins-wsjj-civ Attendance Report,/My Drive/Meeting Reports/2025-07-11 12:04 ins-wsjj-civ/2025-07-11 12:04 ins-wsjj-civ Attendance Report,application/vnd.google-apps.spreadsheet,2025-07-11T16:53:56.699Z,pcuenco@elhaynes.org,1024,,1YlidoQ3jh4MF-KlF0e9ll2q8S5Q2dS1T
1Nk7U4HWuu6zXL3d4ILcLFkwPrNqAeNqhFqfe4mVU370,2025-08-26 12:50 ero-sqvr-wxo Attendance Report,/My Drive/Meeting Reports/2025-08-26 12:50 ero-sqvr-wxo/2025-08-26 12:50 ero-sqvr-wxo Attendance Report,application/vnd.google-apps.spreadsheet,2025-08-26T17:05:24.889Z,pcuenco@elhaynes.org,1024,,1INg4wZIbo84j3RSaOtXpyfxSddIelzfz
1Ve0gMdThYIi06gQsQa4fZiKsIoKzaX24Tb0aggm-l64,2025-09-04 10:46 hfh-bskz-xgk Attendance Report,/My Drive/Meeting Reports/2025-09-04 10:46 hfh-bskz-xgk/2025-09-04 10:46 hfh-bskz-xgk Attendance Report,application/vnd.google-apps.spreadsheet,2025-09-04T15:13:41.959Z,pcuenco@elhaynes.org,1024,,19qD9speoblPTzXMbOxWFvfdE8P7gGMg6
1klF2id7f9gWYWSu3eulYaVg-r4R2I4Qr5qffs5VTjds,2025-09-17 15:28 dac-fyqh-dwk Attendance Report,/My Drive/Meeting Reports/2025-09-17 15:28 dac-fyqh-dwk/2025-09-17 15:28 dac-fyqh-dwk Attendance Report,application/vnd.google-apps.spreadsheet,2025-09-17T19:41:30.901Z,pcuenco@elhaynes.org,1024,,1qY6ep1GlTmdaBK4Unw3q2AfVv79lvgnM
1005gmnStaMSWuPatEMb-CpXuCryJ7kZkKCicsOFVKu8,2025-09-23 12:06 owt-wqhb-ejd Attendance Report,/My Drive/Meeting Reports/2025-09-23 12:06 owt-wqhb-ejd/2025-09-23 12:06 owt-wqhb-ejd Attendance Report,application/vnd.google-apps.spreadsheet,2025-09-23T17:31:10.087Z,pcuenco@elhaynes.org,1024,,1fINomcNblKg5qkrjOkm9WIyDNbOZiWt0
1rvgF0o4bqN_mZe6rMs2H6DjRxk6d6swtgDhZQ9ZX8mSPcARYiXtavTgq5fWsS7OCSSREOocW,E.L. Haynes (9/19/25),/My Drive/Classroom/E.L. Haynes (9/19/25),application/vnd.google-apps.folder,2025-09-18T13:34:57.960Z,pcuenco@elhaynes.org,,,19F2HJkmHKlh4aOY6V3YWWXCbamtTWYSlRHd-xPwXpWUBwRtSgKjXn_9e5SicJgo7Fj82lpup
1VTSrMBUfEqz0w7njtpQsSn6AexjEyMwqFlaeXNmEqz620ZfstNKppPj_nCCau1it-8oCpJHq,E.L. Haynes Sandbox,/My Drive/Classroom/E.L. Haynes Sandbox,application/vnd.google-apps.folder,2025-07-21T16:49:41.384Z,pcuenco@elhaynes.org,,,19F2HJkmHKlh4aOY6V3YWWXCbamtTWYSlRHd-xPwXpWUBwRtSgKjXn_9e5SicJgo7Fj82lpup
17C--ljEP7ZvtV7nY4dJcfq7Ax__oPYZOXnfVCG8GViIr7jPrdUrC-vfWARMZDub8PAd5ZSh0,Tech Club,/My Drive/Classroom/Tech Club,application/vnd.google-apps.folder,2025-05-14T20:14:41.612Z,pcuenco@elhaynes.org,,,19F2HJkmHKlh4aOY6V3YWWXCbamtTWYSlRHd-xPwXpWUBwRtSgKjXn_9e5SicJgo7Fj82lpup
1cYJ1MI8Lrfy2Uuo6O7MZsS1BB6bpl7WWYyMZ6qF_9e7sx8WsERlFeJxKuhYf_aU_ojpy3GM,Peter Cuenco - [Template] Self-Introduction,/My Drive/Classroom/E.L. Haynes Sandbox/Peter Cuenco - [Template] Self-Introduction,application/vnd.google-apps.shortcut,2025-07-27T21:22:04.690Z,pcuenco@elhaynes.org,,,1VTSrMBUfEqz0w7njtpQsSn6AexjEyMwqFlaeXNmEqz620ZfstNKppPj_nCCau1it-8oCpJHq
1d5hFB_0KygArufXIfronQGb0OxgA-fxyTxq_gGEQsMRH3iQh8kxvLFrSz_lU_crTepDXI5w,Peter Cuenco - Sample Assignment,/My Drive/Classroom/E.L. Haynes Sandbox/Peter Cuenco - Sample Assignment,application/vnd.google-apps.shortcut,2025-07-21T17:12:16.533Z,pcuenco@elhaynes.org,,,1VTSrMBUfEqz0w7njtpQsSn6AexjEyMwqFlaeXNmEqz620ZfstNKppPj_nCCau1it-8oCpJHq
1rfvVi777hW81unHBxpm2F3W2ixubbH4uwYP-MXmE4j2hmEuhU7lsl3-CP20nsJaENvAdmFw,Peter Cuenco - Originality Report: Participant,/My Drive/Classroom/E.L. Haynes (9/19/25)/Peter Cuenco - Originality Report: Participant,application/vnd.google-apps.shortcut,2025-09-19T18:10:38.609Z,pcuenco@elhaynes.org,,,1rvgF0o4bqN_mZe6rMs2H6DjRxk6d6swtgDhZQ9ZX8mSPcARYiXtavTgq5fWsS7OCSSREOocW
1T4-p6owX6fLF_ZCcPRJRpx_qeg8O8JTANbShAouDOS64tVBdcm8G52PfsYWglgo1ohlFhZI,Peter Cuenco - Self-Introduction,/My Drive/Classroom/E.L. Haynes (9/19/25)/Peter Cuenco - Self-Introduction,application/vnd.google-apps.shortcut,2025-09-19T17:12:57.606Z,pcuenco@elhaynes.org,,,1rvgF0o4bqN_mZe6rMs2H6DjRxk6d6swtgDhZQ9ZX8mSPcARYiXtavTgq5fWsS7OCSSREOocW
1r_RhNQY9fsG7gzCYwZhjTI0QhF6out0f,scripts,/My Drive/Laptop/scripts,application/vnd.google-apps.folder,2025-10-08T14:14:47.229Z,pcuenco@elhaynes.org,,,1E4jihCMzZaWoQFts704Axkjg8R8yVHRo
1O0taPg3yzaYu3HKTU_Evnzs0Qpns0JTu,Scripts,/My Drive/Laptop/Scripts,application/vnd.google-apps.folder,2025-10-08T14:14:28.579Z,pcuenco@elhaynes.org,,,1E4jihCMzZaWoQFts704Axkjg8R8yVHRo
1Q1Jv-1ll28Ac88MVCb6se8RF351UgkPs,projects,/My Drive/Laptop/scripts/projects,application/vnd.google-apps.folder,2025-10-08T14:14:47.727Z,pcuenco@elhaynes.org,,,1r_RhNQY9fsG7gzCYwZhjTI0QhF6out0f
15oKNA7mWIKYR46ylxwdPcMhyzTRlFVJ8,.tmp.driveupload,/My Drive/Laptop/scripts/.tmp.driveupload,application/vnd.google-apps.folder,2025-10-08T14:14:47.726Z,pcuenco@elhaynes.org,,,1r_RhNQY9fsG7gzCYwZhjTI0QhF6out0f
1uiBLXWSzPZU-Gevwl-UeeeciRsIb8C4Y,Lastgood,/My Drive/Laptop/scripts/Lastgood,application/vnd.google-apps.folder,2025-10-08T14:14:47.725Z,pcuenco@elhaynes.org,,,1r_RhNQY9fsG7gzCYwZhjTI0QhF6out0f
1Jd2Ix0WgO1Z1-Dw4Nc-tNSZL4cJ1-mXm,.git,/My Drive/Laptop/scripts/.git,application/vnd.google-apps.folder,2025-10-08T14:14:47.710Z,pcuenco@elhaynes.org,,,1r_RhNQY9fsG7gzCYwZhjTI0QhF6out0f
1WsFF8r75P1bx13cJdUMJ63gTFdhIo1NJ,forms,/My Drive/Laptop/scripts/forms,application/vnd.google-apps.folder,2025-10-08T14:14:47.709Z,pcuenco@elhaynes.org,,,1r_RhNQY9fsG7gzCYwZhjTI0QhF6out0f
16iYx18AXAiLvyNAkHxMjAMLIrxncmIsB,__pycache__,/My Drive/Laptop/scripts/__pycache__,application/vnd.google-apps.folder,2025-10-08T14:14:47.697Z,pcuenco@elhaynes.org,,,1r_RhNQY9fsG7gzCYwZhjTI0QhF6out0f
16pIVgU7JjD8Iy3BrhRHCqbKiZpqW9uvR,win11-upgrade.ps1,/My Drive/Laptop/scripts/win11-upgrade.ps1,application/octet-stream,2025-10-08T12:48:14.000Z,pcuenco@elhaynes.org,8042,,1r_RhNQY9fsG7gzCYwZhjTI0QhF6out0f
18AXmwq77GGGZ4aKeebR4qaL86vtFsEEf,monthly-reports.py,/My Drive/Laptop/scripts/monthly-reports.py,text/x-python,2025-10-07T15:48:48.000Z,pcuenco@elhaynes.org,7784,,1r_RhNQY9fsG7gzCYwZhjTI0QhF6out0f
1A4q1rYkkYhvRtk7G3QOHCCE8dbuOK-yQ,pcuenco.key.pub,/My Drive/Laptop/scripts/pcuenco.key.pub,application/vnd.ms-publisher,2025-09-26T19:23:29.000Z,pcuenco@elhaynes.org,103,,1r_RhNQY9fsG7gzCYwZhjTI0QhF6out0f
1lvbVVPWT_ay3cILZhOiDJpPQexFFvYV8,pcuenco.key,/My Drive/Laptop/scripts/pcuenco.key,application/x-iwork-keynote-sffkey,2025-09-26T19:23:29.000Z,pcuenco@elhaynes.org,411,,1r_RhNQY9fsG7gzCYwZhjTI0QhF6out0f
1hNKuQGFNihSt6c84lpbDK_OhCO6Yvgqn,disable-exited-student-ou.ps1,/My Drive/Laptop/scripts/disable-exited-student-ou.ps1,application/octet-stream,2025-09-26T16:46:16.000Z,pcuenco@elhaynes.org,1676,,1r_RhNQY9fsG7gzCYwZhjTI0QhF6out0f
1Bk82ICkDitM63rlN5X8RpDOhxKRsw4I4,ad-gam-new-staff.ps1,/My Drive/Laptop/scripts/ad-gam-new-staff.ps1,application/octet-stream,2025-09-25T19:40:20.000Z,pcuenco@elhaynes.org,9025,,1r_RhNQY9fsG7gzCYwZhjTI0QhF6out0f
1HcazmXaLO_-ZK46zNeiwokgzScsLpGEq,disable-exited-staff.ps1,/My Drive/Laptop/scripts/disable-exited-staff.ps1,application/octet-stream,2025-09-24T14:51:33.000Z,pcuenco@elhaynes.org,1754,,1r_RhNQY9fsG7gzCYwZhjTI0QhF6out0f
12CCICx7dMQrArjvY8in6pmHF0RumD1Fc,gamusers.ps1,/My Drive/Laptop/scripts/gamusers.ps1,application/octet-stream,2025-09-24T12:47:41.000Z,pcuenco@elhaynes.org,1140,,1r_RhNQY9fsG7gzCYwZhjTI0QhF6out0f
1MEvZImNhwHmkP5q3Kqe1SiRC9mmoKGJq,create-new-contractor.ps1,/My Drive/Laptop/scripts/create-new-contractor.ps1,application/octet-stream,2025-09-17T18:58:34.000Z,pcuenco@elhaynes.org,8270,,1r_RhNQY9fsG7gzCYwZhjTI0QhF6out0f
1z2CoBdKPj9sr7l8Cq3GIldJWR44-jpW2,1create-new-contractor.ps1,/My Drive/Laptop/scripts/1create-new-contractor.ps1,application/octet-stream,2025-09-11T17:11:00.000Z,pcuenco@elhaynes.org,8512,,1r_RhNQY9fsG7gzCYwZhjTI0QhF6out0f
1-Drso_oy0C_1zQEnsaJwIUTGw28m959y,ad-gam-create-new-staff.ps1,/My Drive/Laptop/scripts/ad-gam-create-new-staff.ps1,application/octet-stream,2025-09-10T18:30:11.000Z,pcuenco@elhaynes.org,9007,,1r_RhNQY9fsG7gzCYwZhjTI0QhF6out0f
1LJ_pl63d1-6d-Yai0aFzUhimcW6bGYIE,ad-gam-create-new-student.ps1,/My Drive/Laptop/scripts/ad-gam-create-new-student.ps1,application/octet-stream,2025-09-03T19:44:18.000Z,pcuenco@elhaynes.org,8664,,1r_RhNQY9fsG7gzCYwZhjTI0QhF6out0f
1XLdIwkkW1n_-og8PvWFoLjE0_TBmLJAP,ad-gam-create-new-student - Copy (2).ps1,/My Drive/Laptop/scripts/ad-gam-create-new-student - Copy (2).ps1,application/octet-stream,2025-09-02T18:27:55.000Z,pcuenco@elhaynes.org,8085,,1r_RhNQY9fsG7gzCYwZhjTI0QhF6out0f
